568,ていうか君たちの話聞かせてくれよ,ていうか記味たちの話聴かせてくれよ,16,3
569,みんな体面ばっか気にしてる感じですね,みんな台面ばっか気にしてる感じですね,18,1
570,あの子たちちゃんと話さないでしょ,あの固達ちゃんと話さないでしょ,16,3
571,わたしに向いてくれないと困るの,私に向いてくれないと困るの,15,3
572,塾関係者も見ていません,熟館経者も見ていません,11,3
573,出ていった人物もまだ分からん,出て行った人物もまだわからん,14,2
574,でもたぶん彼女は乗ってくる,でも多分彼女は乗ってくる,13,3
575,温情と理解をもって当たり,温情と理解を持ってあたり,12,2
576,その心情を傷つけないように,その心情を築つけないように,13,1
577,定規とコンパスで描ける,上義とコンパスで描ける,11,2
578,なんかすごく盛り上がってる,なんかすごく盛り上がってる,13,0
579,距離があると盛り上がるけど,距離があると盛り上がるけど,13,0
580,でも殺害そのものは否定してます,でも冊外そのものは否定してます,15,2
581,売られてるのが分かりました,売られてるのがわかりました,13,1
582,わたしも持ってるよこれ,私も持ってるよこれ,11,3
583,証拠隠滅を図ろうとする犯人は,小庫員滅をはかろうとする犯人は,14,5
584,ものを考えることができる,ものを考えることができる,12,0
585,それで腹を立てたってわけか,それで払を立てたってわけか,13,1
586,やってもらえないかなと思って,やってもらえないかなと思って,14,0
587,緊張状態を見ようとした,緊張状態をみようとした,11,1
588,あなたたちの狙いは最初から,あなたたちの狙いは最初から,13,0
589,じいちゃんたちがやってるから,時井ちゃんたちがやってるから,14,2
590,またわたしが疑われてる,また私が疑われてる,11,3
591,今日は色と面白い話があるの,今日は色と面白い話があるの,13,0
592,常温のミネラルウオタを飲むとは,上温のみねらるウオタを飲むとは,15,5
593,そうやって温めるだけで,そうやって温めるだけで,11,0
594,あおむけをうつぶせってするだけでも,青向けを映無切ってするだけでも,17,7
595,わたし先生を殺しちゃった,私先生を殺知ちゃった,12,4
596,ところが思いも寄らずなのか,ところが思いもよらずなのか,13,1
597,あなたは最初乾いた血痕の上から,あなたは最初川愛結婚の上から,15,5
598,さらにその上にまたすぐに,さらにその上にまたすぐに,12,0
599,皮肉にも漂白剤をまいたことで,日肉にも表迫剤を巻いたことで,14,4
600,増岡先生のとこが割られてた,ます岡先生のと小が割れてた,13,4
601,何でかなってずっと考えてた,なんでかなってずっと考えてた,13,2
602,増岡先生が付き合ってたのは,ます岡先生が付き合ってたのは,13,2
603,なのにどうして冷静じゃないんだろううって,なのにどうして冷静じゃないんだろううって,20,0
604,気に入ったら後で購入するってやつ,気に入ったら後で購入するってやつ,16,0
605,由貴を遊んでやったとか,雪を遊んでやったとか,11,2
606,だから思わずそれだけ捨ててしまった,だから思わずそれだけ捨ててしまった,17,0
607,さっきから言ってるよね,さっきから言ってるよね,11,0
608,二宮先生が行っていたという,二宮先生が行っていたという,13,0
609,だったら二宮先生じゃん,だったらに飲みや先生ジャン,11,7
610,そういうのが確たる証拠っていうの,そういうのがカクタル証拠っていうの,16,4
611,対策室もよくやったじゃん,対策質もよくやったじゃん,12,1
612,出てきたの二宮先生のロッカじゃないよ,出てきたの二宮先生のロッカじゃないよ,18,0
613,わたし物覚え悪いから間違ってて,私もの覚え悪いから間違ってて,15,4
614,間違えてあなたに伝えちゃった,間違えてあなたに伝えちゃった,14,0
615,先生みたいに奇麗になりたいなと思って,先生みたいにキレイになりたいなと思って,18,3
616,奇麗になれるかなと思って,きれいになれるかなと思って,12,3
617,じゃああのポリグラフも,じゃああのポリグラフも,11,0
618,ほかにも遊んだ女のことも,ほかにも遊んだ女のことも,12,0
619,今度刑務所から出てくるときは,今度計務所から出てくるときは,14,1
620,でもお前に来た話だから,でもお前に来た話だから,11,0
621,マスコミ向けの広告塔じゃありませんから,マスコミ向けの広告とうじゃありませんから,19,2
622,お前だってきちんとメークしてけば,お前だってきちんとメUクしてけば,16,1
623,リラックスして楽しんでいってください,リラックスして楽しんで言ってください,18,1
624,それではよろしくお願いします,それではよろしくお願いします,14,0
625,さらには女性初の室長と,さらには女性初の失張と,11,2
626,俺こういうの苦手なんだけどね,俺こういうの苦手なんだけどね,14,0
627,きちんとできていますので,きちんとできていますので,12,0
628,買ったばかりの育毛剤なんですけど,買ったばかりの行く網財なんですけど,16,4
629,今日はあの怖い女がいない,今日はあの怖い女がいない,12,0
630,事件解決へとつながってるんですね,事件解決へとつながってるんですね,16,0
631,プライベートは普通の女ですから,プライベUトは普通の女ですから,15,1
632,似たようなもんなんですね,似たようなもんなんですね,12,0
633,この仕事ではよくあることなんです,この仕事ではよくあることなんです,16,0
634,最近の社員はすぐびびっちゃって,最近の社員はすぐびびっちゃって,15,0
635,おそらく大量のアルコールで,おそらく対量のあるコUルで,13,4
636,極秘写真をすっぱ抜いてきた,ごく飛写心を刷派縫いてきた,13,8
637,取り組む姿勢に変わりはない,取り組し性に代わりはない,13,4
638,イケメンもおるのかしら,イケメンもオルのかしら,11,2
639,まったく不自然な点がない,まったく不自然な点がない,12,0
640,本当に脱がなくていいから,本当にぬがなく定意から,12,4
641,ここでお酒を飲んでいても,ここでお酒を飲んでいても,12,0
642,ましてアルコールに酔って,ましてあるコUルによって,12,4
643,そのまさかを追及するのが,そのまさかを追求するのが,12,1
644,何かおったような気がするけどな,何か追ったような気がするけどな,15,1
645,プライベート中の追い掛けるの,プライベUト中の追いかけるの,14,2
646,事件に関しての続報です,事件に関しての続報です,11,0
647,できるわけないじゃない,できるわけないじゃない,11,0
648,テレビはついてたみたいですけど,テレビはついてたみたいですけど,15,0
649,それからは食いつなぐために,それからはくいつなぐために,13,1
650,こんなのいちいち気にしてたら,こんなの一一気にしてたら,14,4
651,カメラマンとして活動していた,カメラマンとして活動していた,14,0
652,病気にかかり仕事を休んでいたか,病気に書かり仕事を休んでいたか,15,1
653,あの事故死を調べてるんですよね,あの事故詞を調べてるんですよね,15,1
654,事故死で片付けられたものを,自己子で片付けられたものを,13,3
655,でも再捜査してよかったですよ,でも最操作して良かったですよ,14,4
656,つまり実際の事件現場に,つまり実際の事件現場に,11,0
657,何かあったらすぐ連絡下さい,何かあったら優連絡下さい,13,2
658,ぱっと見ていい女って思われないと,パッと未定い女って思われないと,16,5
659,これあなたの読みどおり,これあなたの読み通り,11,2
660,爪の先は面が滑らかなの,つ目の先は麺が滑らかなの,11,3
661,こういうささくれは何かに触っていると,こういうささくれは何かに触っていると,18,0
662,第三者の手によって切られた,第三者の手によって切られた,13,0
663,この男ひと月ほど前から,この男人月ほど前から,11,2
664,ただ職業上の接点はない,ただ食業状の設点はない,11,3
665,ストーカー殺人の現場にいたディレクター,ストUカU札人の現場にいたディレクタU,19,4
666,ここに来るまでに迷っちゃった,ここに車でに迷っちゃった,14,3
667,わたしは自分の目で見て,私は自分の目で見て,11,3
668,自分の目で見て確かめたいの,自分の目で見て確かめたいの,13,0
669,たまたま近くで取材してたから,たまた街近で取材してたから,14,2
670,そろそろ時間だからまた,そろそろ時間だからまた,11,0
671,こちらこそごめんなさい,こちらこそごめんなさい,11,0
672,スクープ映像を解析したものよ,スクUプ映像を解析したものよ,14,1
673,運航していた船のエンジン音,運行していた船のエンジンオン,13,3
674,刃物のようなもので首を刺され,はもののようなもので首を差され,14,4
675,安田に弱みを握られていて,安田に弱みを握られていて,12,0
676,高峰仁美がお送りしました,高嶺人磨お送りしました,12,4
677,死因は現在分かっておりません,死因は現在分かっておりません,14,0
678,とんでもない不祥事だぞ,とんでもナイフ証示だぞ,11,5
679,君に責任取ってもらわないとな,君に責任とってもらわないとな,14,1
680,亡くなった男性東郷英憲さんは,なくなった男性統合費で乗りさんは,14,7
681,発見後すぐに助けに入ったかのように,発見後すぐに助けに入ったかのように,17,0
682,映像を一部切り取り編集しました,映像を一部切り取り編集しました,15,0
683,しかし捏造スクープの映像を,しかし熱増スクUプの映像を,13,3
684,カプセルを服用して死んだ,カプセルを服用して診だ,12,2
685,高峰にカプセル飲ますのは無理やな,高嶺にカプセルのマスのは無理屋な,16,5
686,たった今からこのヤマは,たった今からこの山は,11,2
687,上の結論が出るまでお前たちは,上の結論が出るまでおまえたちは,14,2
688,ここでおとなしく待ってろ,ここでおとなしくまってろ,12,1
689,俺だってつらいんだからさ,俺だってつらいんだからさ,12,0
690,取り調べ中に人が死んでるんだろう,取調中に人が死んでるんだろう,16,2
691,捜査に決まってるじゃない,操作に決まってるじゃない,12,2
692,捜査担当から外されたんですってね,操作担当から外されたんですってね,16,2
693,大変な問題を起こしたんだから,大変な問題を起こしたんだから,14,0
694,こんなもんもらっちゃってねぇ,こんなもんもらっちゃってねぇ,14,0
695,捜査を続行させてほしいってさ,捜査を続行させてほしいってさ,14,0
696,大沢絵里子は首だけどな,大沢エリコは首だけどな,11,3
697,アリバイの裏取ってきました,ありばいの裏とってきました,13,5
698,そこから分かった新事実が幾つか,そこから分かった新事実がいくつか,15,2
699,まず東郷の体内から出てきた,まず統合の体内から出てきた,13,2
700,生放送前で忙しいんだけど,生放送前で忙しいんだけど,12,0
701,あなたに一番最初に伝えようと思って,あなたに一番最初に伝えようと思って,17,0
702,その日あなたが東郷に青酸カリを,その日あなたが統合に製産かりを,15,6
703,この成分はニトロセルロース樹脂,この西武はにとろせるロUス受止,15,10
704,まず青酸カリ入りのカプセルを,まず制産かり入りのカプセルを,14,4
705,マニキュアのクリアコートでコーティングする,間にキュアのクリアコUトでコUティングする,21,4
706,これで溶けだす時間を調整できる,これでとけ出す時間を調整できる,15,2
707,これを服用すると塩酸ロペラミドで,これを服用すると演散ロペラミドで,16,2
708,毒入りカプセルが溶けだし,どく入りカプセルが溶け出し,12,3
709,カプセル剤を飲まなければいけないことを,カプセル剤を飲まなければいけないことを,19,0
710,体内に残った成分を計算すると,体内に残った西武を計算すると,14,2
711,東郷がカプセルを服用したのは,統合がカプセルを服用したのは,14,2
712,それから安田のお風呂場で,それから安田のお風呂場で,12,0
713,優秀なジャーナリストだった,優秀なジャUナリストだった,13,1
714,わたしが大きくならないといけない,私が大きくならないといけない,16,3
715,たとえどんなに小さな声でも,例えどんなに小さな声でも,13,2
716,生放送中に自白するなんて,生放送中に辞はくするなんて,12,3
717,最近残業するようになったらしいね,最近残業するようになったらしいね,16,0
718,そういえば昨日の野立会にも来なかった,そういえば機能のの脱会にもこなかった,18,5
719,イケメンが集う異業種交流会だ,イケメンが集う医業手交流会だ,14,2
720,片桐が来ないと戦力にならん,型切りが来ないと戦力にならん,13,3
721,まあそんなかりかりするな,まあそんなカリカリするな,12,4
722,また野立会に来なくなる,またの脱会にこなくなる,11,3
723,ヤマムーにウィッグかぶせて,やマムUニィッグ駆ぶせて,13,5
724,殺人を起こしてるヒットマンや,殺人を起こしてるヒット万や,14,2
725,今回対立する組織の幹部を,今回対立する組織の幹部を,12,0
726,それに送られてきたこの人形,それに送られてきたこの人形,13,0
727,小野田班と協力して捜査をする,小野田半と協力して捜査をする,14,1
728,所持してることには変わりはない,所持してることには変わりはない,15,0
729,最近ライフル弾を購入した人は,最近ライフルダンを購入した人は,14,2
730,まだ仕事中なんだけどね,まだ仕事中なんだけどね,11,0
731,彼女は飛びっ切りの美人だから,彼女は飛びっきりの美人だから,14,1
732,銃弾から使われたライフルは,充団から使われたライフルは,13,2
733,おそらく狩猟用のレミントンを,おそらく主料用のレミントンを,14,2
734,スケジュール見ておくから,スケジュUル見ておくから,12,1
735,この人何も分かってない,この人何もわかってない,11,1
736,この人形はおそらくこれから,この人形はおそらくこれから,13,0
737,これは部長クラスしか見れないんだけど,これは無長クラスしか見れないんだけど,18,1
738,呼び出すなよこんな所に,呼び出すなよこんなところに,11,3
739,警視庁幹部が仲悪かったんだ,警視長幹部が中悪かったんだ,13,2
740,独自に捜査を進めていたんだ,独自に操作を進めていたんだ,13,2
741,通常の捜査ならあり得ない,通常の操作ならありえない,12,3
742,谷本が同じ格好をさせて,他に元が同じ格好をさせて,11,3
743,警察の動向見るためにな,警察の動向みるためにな,11,1
744,救急車で運ばれたが間もなく,救急車で運ばれたがまもなく,13,1
745,仲間を殺すのはやめるよ,中間を殺すのはやめるよ,11,1
746,あそこで発砲するのはやむを得ない処置,あそこで発砲するのはやむをえない所地,18,3
747,ずっと背負っていくしかない,ずっとせおっていくしかない,13,2
748,例の刑事さんが撃たれたっていうの,例の刑事さんが打たれたっていうの,16,1
749,警備しなくちゃいけなくて,競びしなくちゃいけなくて,12,2
750,ターゲットはその誤射事件に関連した,タUゲットはその誤い時県に関連した,17,4
751,これでまた誰かが殺される,これでまた誰かが殺される,12,0
752,関係してる可能性も含め,関係してる可能性も含め,11,0
753,この仕事自体忘れとんちゃうかな,この仕事自体忘れトンちゃうかな,15,2
754,誤って撃たれた武藤さんが,誤って打たれたむ統産が,12,5
755,それに当時女性刑事ばかりを集めて,それに当時女性刑事ばかりを集めて,16,0
756,ライバルの野立が注目されていた,ライバルののだちが注目されていた,15,3
757,組織犯罪を統括する長として,組織犯罪を統括する超として,13,1
758,スタンドを分割して警備を行う,スタンドを分割して警備を行う,14,0
759,本当の黒幕はこいつなのよ,本当の黒幕は個いつなのよ,12,1
760,大げさに吹っ飛びやがってお前,大げさにふっとビヤがってお前,14,4
761,別にいいじゃないっすか,別にいいじゃないっすか,11,0
762,もう泣いていい見ないから,もう内定意味ないから,12,6
763,俺たち最強ツートップだ,オレたち最強ツUトップだ,11,3
764,相談する女なんかいません,相談する女難開いません,12,3
765,どうせまたマスコミ向けに押し付けられた,どうせまたますコミ向けに押し付けられた,19,2
766,僕がまだ交番勤務時代に,僕がまだ後バンキンム時代に,11,6
767,小野田班はすでに動いている,小野田半はすでに動いている,13,1
768,君たちも至急捜査に当たってくれ,君たちも支給捜査にあたってくれ,15,3
769,前のあれも恋ちゃうちゅうねん,前のあれも恋知中年,14,8
770,デートなんて行かせないよ,デUトなんていかせないよ,12,2
771,木元と花形はわたしと現場に,木元とは長田は私と現場に,13,6
772,片桐は科捜研と連携して,型切りは仮想検と連携して,11,6
773,高いことが分かりました,高いことがわかりました,11,1
774,こう斜めになっていたり,後名な目になっていたり,11,4
775,複数いることを指してる,複数いることを指してる,11,0
776,傷害と窃盗の前科のある男や,障害と窃盗の全家のある男や,13,3
777,見慣れてるみたいですね,みなれてるみたいですね,11,2
778,内藤は孤立してたみたいや,内藤はこりつしてたみたいや,12,3
779,もう一度ガイ者周りをあたって,もう一度外社周りを与って,14,5
780,小野田班からの報告がありました,小野田半からの報告がありました,15,1
781,会ってなく絶縁状態にあるそうです,あってなく絶演状態にあるそうです,16,2
782,子供を置いて逃げるなんて,子どもを置いて逃げるなんて,12,2
783,警察の方とのコミュニケーションは,警察の法とのコミュニケUションは,16,2
784,開設してらっしゃいますが,解説してらっしゃいますが,12,2
785,個別に相談がある場合は,個別に相談がある場合は,11,0
786,追い込んでしまうことが多いんです,おいこんでしまうことが多いんです,16,2
787,いつか父親に認められたい,いつか父親に認められたい,12,0
788,愛されたいと願っていました,愛されたいと願っていました,13,0
789,先客がいたみたいだから,選客が痛みたいだから,11,3
790,一歩も外には出なかったと言っていました,一歩も外にはでなかったと言っていました,19,1
791,現場の土が車内から出るはずだから,現場のドが社内から出るはずだから,16,2
792,ということは証言は本当か,ということは正源は本当か,12,2
793,とにかくお前はおとなしくしてろ,とにかくお前は音なしくしてろ,15,2
794,ジョギング中の女性が発見しています,ジョギング中の女性が発見しています,17,0
795,ナイフでのど元を一撃された後に,ナイフでのどもとを一撃された後に,15,2
796,むちゃくちゃな殺し方だが,むちゃくちゃな頃し方だが,12,1
797,後始末だけはしっかりしている,あとしまつだけはしっかりしている,14,5
798,マスコミにたたかれるんだ,マスコミに戦れるんだ,12,3
799,マスコミ対応の方もばっちりやって,マスコミ対応の方もばっちりやって,16,0
800,じゃそのサイト閲覧者が,邪助のサイト閲覧者が,11,3
801,そのメールを見られる全ての人間が,そのメUルを見られるすべての人間が,16,3
802,年齢も虐待方法も親父そっくりだ,年齢も逆帯方法も親時速クルだ,15,7
803,警視庁の大沢絵里子です,警視庁の大沢エリコです,11,3
804,それで一応先生の事件当日の,それで一応先生の事件当日の,13,0
805,その時間はわたし寝ていましたから,その時間は私ねていましたから,16,4
806,この現場から宮川さんの自宅は,この現場から宮川さんの自宅は,14,0
807,宮川さんは鋭利な刃物で,宮川さんは永理なはもので,11,5
808,現場に残された靴跡ですが,現場に残された靴アトですが,12,2
809,そんなことあるわけないですよ,そんなことあるわけないですよ,14,0
810,その時間は教授室にいました,その時間は教授室にいました,13,0
811,共有パソコンにカメラ付いてるから,共有パソコンにカメラついてるから,16,1
812,前後の日も含めて終日全部,前後の日も含めて週日全部,12,1
813,ただ捜査を混乱させるだけだから,ただ操作を混乱させるだけだから,15,2
814,だったら最後に一緒にやろうよ,だったら最後に一緒にやろうよ,14,0
815,父親にひどい虐待を受けていた,父親にひどい逆滞を受けていた,14,2
816,狭い押し入れの中に閉じ込められた,狭い押し入れの中にと事故められた,16,3
817,そんな毎日が何年も続いた,そんな毎日が何年も続いた,12,0
818,立ち直ることができなかった啓介さんは,立ち直ることができなかった系透さんは,18,2
819,それを発見したあなたは,それを発見したあなたは,11,0
820,押し入れに閉じ込められて,押し入れにと自己められて,12,3
821,直接的な表現がいいかも,直接的な表現がいいかも,11,0
822,気付かないでいたなんて,気付かないでいたなんて,11,0
823,教授室に入ったときには,教授室に入った時には,11,2
824,利き手が変わることはまれではないの,聞き手が変わることはまれではないの,17,1
825,これは自分に起こってることではないと,これは自分に怒ってることではないと,18,2
826,思い込んでしまったのね,思い込んでしまったのね,11,0
827,たくさん救ってきたのは事実です,たくさんすくってきたのは事実です,15,2
828,啓介さんの人格ではなく,系床さんの人格ではなく,11,2
829,何か切なくなっちゃったな,何か設なくなっちゃったな,12,1
830,ちょっと大事なこと言いに来た,ちょっと大事なこと言いに来た,14,0
831,女性への関心は極めて強いが,女性への関心は極めて強いが,13,0
832,お前ら今消しゴム盗んだろうう,おまえらいま消しごむぬすんだろうう,14,8
833,だからお母さん駄目ですって,だからお母さんだめですって,13,2
834,講習やってるんですから,講習やってるんですから,11,0
835,対策室の面々は人が足りない,対策質の面々は人が足りない,13,1
836,何でわたしが小学生相手に,なんで私が小学生相手に,12,5
837,俺が謹慎処分ってことで,オレが筋新処分ってことで,11,4
838,逆に矛先をかわしたんだよ,逆にほこ先をかわしたんだよ,12,2
839,手伝ってもらうつもりだったけど,手伝ってもらうつもりだったけど,15,0
840,駅前広場に設置された爆弾が,駅前広場に設置された爆弾が,13,0
841,まあ取り調べるしかないやろ,まあ取り調べるしかないやろ,13,0
842,岩井と片桐は被疑者の取り調べ,岩井と肩切りは日議者の取り調べ,14,5
843,かみつかれないようにね,か見つかれないようにね,11,1
844,俺の耳に入ってくるはずだぞ,俺の耳に入ってくるはずだぞ,13,0
845,ごみ箱蹴ったのと今回の事件と,ゴミバコケったのと今回の事件と,14,5
846,それを切り出すタイミング,それを切り出すタイミング,12,0
847,こいつは俺の大学の後輩だ,こいつは俺の大学の後配だ,12,1
848,だがまだ確証がつかめない,だがまだ各正がつかめない,12,2
849,あれも汚職の発覚を恐れた,あれもお食の発覚を恐れた,12,2
850,必死なやつらが上層部にいる,必死悩りらが上装部にいる,13,4
851,犯人の意図が分かりません,犯人の意図が分かりません,12,0
