NUM,EXPECTED,model_epoch_04_gs_61460_beam_width_1,# characters,edit distance
1,ずっと先のことだけどね,ずっと先のことだけどね,11,0
2,おなか減って死にそうだよ,お腹返手市にそうだよ,12,6
3,水野先生がおっしゃったように,水の先生がおっしゃったように,14,1
4,治療法が見つかるかもしれない,治療法が見つかるかもしれない,14,0
5,お母さん代わってあげられなくてごめんね,お母さん変わって挙げられなくてごめんね,19,2
6,お前がそんなことでどうすんだよ,お前がそんなことでどうすんだよ,15,0
7,あいつはそんなヤワじゃねえよ,あいつはそんなやわじゃねえよ,14,2
8,あいつが折れそうになったら,相次が俺そうになったら,13,5
9,弘樹もここしょうゆついてる,広きもここ醤油追いてる,13,7
10,わたしの世界はまるで変わってしまった,私の世界はまるで変わってしまった,18,3
11,後ろから答案用紙集めて,後ろから東案用紙集めて,11,1
12,今年遊んどかないともう遊べないよ,今年遊ど行ないともう遊べないよ,16,2
13,アクアトピアに乗りたい,悪あとピアニノリタイ,11,9
14,女ってよくしゃべんなあと思って,女って良く者弁なあと思って,15,5
15,カメの餌やりとか金魚の餌やりとか,亀の栄やりとか金魚の栄やりとか,16,4
16,そんなの誰かに頼めばいいじゃない,そんなの誰かに頼ればいいじゃない,16,1
17,薬の効果やリハビリの方法を,薬の効果やリハビリの方法を,13,0
18,確認したいと思ってます,確認したいと思ってます,11,0
19,こんなふうに毎日少しずつ,こんな不縁毎日少しずつ,12,3
20,何かができなくなっていくの,何かができなくなっていくの,13,0
21,目を閉じて次の日が来るのがこわい,目を閉じて次の日が来るのが怖い,16,2
22,朝が来て悪くなってるかもしれないと,朝が来て悪くなってるかもしれないと,17,0
23,でもお父さんが聞いたら大変だね,でもお父さんが聞いたら大変だね,15,0
24,だってわたし病気になっちゃったでしょ,だって私病気になっちゃったでしょ,18,3
25,だから先輩にも迷惑かけちゃうかも,だから先輩にも迷惑かけちゃうかも,16,0
26,不公平なことをしようとしてるのは,不幸へいなことをしようとしてるのは,16,3
27,花火大会ぐらい一緒に行くでしょ,花美大会グライイッショニイクでしょ,15,11
28,できること自分から投げ出すなんて,できること自分から投げ出すなんて,16,0
29,神様は不公平だなんて言った,神様は不幸へ伊打なんて言った,13,4
30,浴衣着て髪アップにしたら,床北手かみアップにしたら,12,5
31,先輩きっとびっくりするわよ,先輩きっとびっくりするわよ,13,0
32,お母さんの後光が見えてきたような気がする,お母さんのご講が見えてきたような気がする,20,2
33,わたしは自分を信じて行動すればいい,私は自分を信じて行動すればいい,17,3
34,やっぱ夏は浴衣とスイカと,やっぱなつは床と推火と,12,7
35,お友達もみんなついてるし,お友達もみんなついてるし,12,0
36,見つける必要があります,見つける必要があります,11,0
37,夏休みを利用して検査のための,夏休みを利用して検査のための,14,0
38,入院をされてはいかがでしょうか,入院をされてはいかがでしょうか,15,0
39,効果には個人差があるので,交化には個人差があるので,12,2
40,少し長くなるかもしれないから,少し長くなるかもしれないから,14,0
41,お前たちもう遅いから寝なさい,お前たちもう遅いからねなさい,14,1
42,周りが目に入らなかったんだよ,周りが目に入らなかったんだよ,14,0
43,リハビリを担当する田辺です,リハビリを担当する田鍋です,13,1
44,ショックも考えてみろよ,ショックも考えてみろよ,11,0
45,患者も医師も治療に専念する,患者表も治療に千年する,13,5
46,すぐお見舞い行かなきゃ,すぐおみまいいかなきゃ,11,3
47,クラスのみんなに声かける,クラスのみんなに声かける,12,0
48,亜湖お母さん夕方病院寄ってくるから,あこお母さん遊型病院よってくるから,17,5
49,遅くなると思うんだけど,遅くなると思うんだけど,11,0
50,なるべく早く帰るようにはするけど,なるべく早くかえるようにはするけど,16,2
51,わたしマミと約束あるんだから,私マミと約束あるんだから,14,3
52,今は家族が一致団結して,今は家族が一致団結して,11,0
53,ガトーボヌールのケーキだ,がトUボヌUルのケUキだ,12,4
54,一応人数分買ってあるわよ,一応人数分割手あるわよ,12,3
55,麻生君に会いたくて来たのにね,麻生区んに愛宅的たのにね,14,8
56,一応声はかけたんっすけどね,一応声はかけ単っすけどね,13,2
57,何か感じが変わっちゃった,何か感じが変わっちゃった,12,0
58,今度は捕まんないようにしろよ,今度はつかまんないように白よ,14,4
59,途中まで一緒にいたんだけど,途中まで一緒にいたんだけど,13,0
60,次の日川島で発見されたの,次のにっかわとうで発見されたの,12,6
61,あんまり信用してないらしい,あんまり信用してないらしい,13,0
62,友達来てくれてよかったわね,友だち来てくれてよかったわね,13,2
63,こんなにたくさんもらっちゃった,こんなにたくさんもらっちゃった,15,0
64,動いてくると思いますけれども,動いてくると思いますけれども,14,0
65,両手を上げて手のひらを上にして,両手を挙げて手のひらを上にして,15,1
66,デートに行けるとなったら,デUトに行けるとなったら,12,1
67,そんなことないですって,そんなことないですって,11,0
68,今できること頑張るって決めたんだ,今できることがんばるって決めたんだ,16,3
69,原因不明の神経変性疾患,原因不明の新刑編制疾患,11,4
70,じゃあ結局今日の池内との,じゃあ結局教の池内との,12,2
71,どうしようかと思ってさ,どうしようかと思って差,11,1
72,せっかくの誕生日の日に,せっかくの誕生日の日に,11,0
73,さっき病院に電話きてた,昨季病院に電話来てた,11,4
74,メスは餌を探しに出るんだけど,メスはエサを探しに出るんだけど,14,2
75,その間どんなに腹減っても,その間どんなにはら減っても,12,2
76,ずっと卵守って待ってんだよ,ずっと卵も持って待ってんだよ,13,2
77,本当は先輩は来ないかもって思ってた,本当は先輩は来ないかもって思ってた,17,0
78,何言ってるか分かんなくなっちゃうんだって,何言ってるかわかんなくなっちゃうんだって,20,1
79,最後には寝たきりになって,最後にはネタキリになって,12,4
80,その人物は派手なパンクファッションに,その人物ははでなパンクファッションに,18,2
81,身を包んでいたそうですが,身を包んでいたそうですが,12,0
82,まさにあんな感じでした,まさに案な感じでした,11,2
83,記憶には自信があるんです,記憶には自信があるんです,12,0
84,先ほどあなたが見たのは,先ほどあなたが見たのは,11,0
85,さっき記憶には自信があると,さっきき奥には自信があると,13,2
86,自信がなくなってきました,地震がなくなってきました,12,2
87,でも見てみたかったわね,でも見てみたかったわね,11,0
88,いろいろ教えてくださいね,いろいろ教えてくださいね,12,0
89,事務所の経営に貢献してくださいね,事務所の経営に貢献してくださいね,16,0
90,それはいいじゃないですか,それはいいじゃないですか,12,0
91,協力したのは私たちです,協力したのは私達です,11,2
92,私も協力をお願いされたら,私も協力をお願いされたら,12,0
93,カツラぐらいは被りましたよ,かつらぐらいは公務ましたよ,13,5
94,私もちょっとは協力しました,私もちょっとは協力しました,13,0
95,こういう時はじゃんけんでしょ,こういうときはじゃん件でしょ,14,4
96,宮田さんじゃんけんに勝てて,宮田さんじゃん剣に勝てて,13,2
97,思いっきりのんびりしちゃいましょ,思いっきりのんびりしちゃいましょ,16,0
98,とりあえずお風呂入りましょうね,とりあえずお風呂入りましょうね,15,0
99,恐ろしい殺人事件が起きる事など,恐ろしい殺人事件が起きることなど,15,2
100,のんびりしようって言いましたよね,のんびりしようっていいましたよね,16,1
101,プロデューサーの仕事でしょ,プロデュUサUの仕事でしょ,13,2
102,撮り方の工夫で何とかするから,取り方の工夫でなんとかするから,14,3
103,あさすが大女優って感じ,朝すが大女優って感じ,11,2
104,高校の時の友人なんです,高校の時の友人なんです,11,0
105,私たちここに泊まってるの,私たちここにとまってるの,12,1
106,まだ駆け出しみたいですけど,まだ掛け出しみたいですけど,13,1
107,お肌ツルツルになるんですって,おは脱るつるになるんですって,14,5
108,いろいろと苦労したんだね,いろいろと苦労したんだね,12,0
109,私は今回だけなんだけどね,私は今回だけなんだけどね,12,0
110,真理江さんは体調が悪いみたいで,マリエさんは体調が悪いみたいで,15,3
111,何かちょっと怖そうな人ね,何かちょっと怖そうな人ね,12,0
112,ホントはいい人なんだよ,ホントはいい人なんだよ,11,0
113,朝から監督の姿が見当たらなくて,朝から監督の姿が見当たらなくて,15,0
114,スケジュールも狂っちゃって,スケジュUルもクルっちゃって,13,3
115,私そんなメール出してません,私そんなメUル出してません,13,1
116,送信記録が残ってますよ,送信記録が残ってますよ,11,0
117,温泉で殺人事件と遭遇したの,温泉で殺人事件と総遇したの,13,1
118,写真だけでわかるわけないだろ,写真だけでわかるわけないだろ,14,0
119,山岡監督と田代睦美の間には,山岡監督と確む積みの間には,13,4
120,という憶測が飛び交っている,という億束が飛び交っている,13,2
121,マスコミで話題になっている事件だけに,マスコミで話題になっている事件だけに,18,0
122,勝訴すれば事務所の名前が上がりますね,消訴すれば事務所の名前が上がりますね,18,1
123,あなたがそこまで言うんだったら,あなたがそこまで言うんだったら,15,0
124,それは私がよく知っています,それは私がよく知っています,13,0
125,ホテルの最上階にある展望風呂,ホテルの最上階にある展望風呂,14,0
126,郡山まで行く車の中から,氷山まで行く車の中から,11,1
127,先に帰ったお詫びをしておこうと思って,先に帰ったお詫びをしておこうと思って,18,0
128,そこで最上階の展望風呂の事を,そこで最上階の展望フロのことを,14,4
129,お肌がツルツルになるから,お肌がつるつるになるから,12,4
130,協力するから何でも言ってね,協力するから何でも言ってね,13,0
131,誰かが勝手に自分の携帯を使って,誰かが勝手に自分の携帯を使って,15,0
132,真犯人が見つからないまでも,新犯人が見つからないまでも,13,1
133,では被告人は席に戻ってください,では被告人は席に戻ってください,15,0
134,切迫流産の危険があったそうですが,拙迫留料の危険があったそうですが,16,3
135,数日入院すれば心配ないそうです,数日乳インスレバシン配応そうです,15,10
136,じゃあ裁判はいずれ再開されますね,じゃあ裁判はいずれ再開されますね,16,0
137,それにしても前代未聞ね,それにしても前代未問ね,11,1
138,睦美どうして教えてくれなかったんだろう,むつみどうして教えてくれなかったんだろう,19,3
139,監督が恨まれるなんてないと思う,監督が裏まれるなんてないと思う,15,1
140,厳しいけど思いやりのある人だから,厳しいけど思いやりのある人だから,16,0
141,常連に売ったような気がしますね,常連に行ったような気がしますね,15,1
142,じゃ山岡さんが殺害された時刻に,じゃや魔重さんが殺害された時刻に,15,3
143,ラウンジであなたと一緒にいたのは,ラウンジであなたと一緒にいたのは,16,0
144,ありがとうございました,ありがとうございました,11,0
145,何か睦美ちゃんに不利になる事を,何かむつみちゃんに不利になることを,15,5
146,告げ口するみたいで話しにくくてね,つげ口するみたいで話しにくくてね,16,1
147,拘置所に戻されたそうよ,高知所に戻されたそうよ,11,2
148,色々訊いて回ったんですけど,いろいろ聞いてまわったんですけど,13,7
149,あの日先に東京に帰ってます,あの日先に東京に帰ってます,13,0
150,香山プロデューサーが証言してます,傘マプロデュUサUが証言してます,16,4
151,インターネットを通じて投稿するんです,インタUネットを通じて投稿するんです,18,1
152,この動画が投稿されたのが,この動画が投稿されたのが,12,0
153,つまり事件翌日の朝です,つまり事件翌日の朝です,11,0
154,やっぱり撮影されたのは,やっぱり撮影されたのは,11,0
155,帽子とマスクの男いたじゃないですか,防止とマスクの男いたじゃないですか,17,2
156,あの正体がわかったんです,あの正体がわかったんです,12,0
157,相手役を務める須藤健一さんから,相手約を務めるすとう堅致いさんから,15,7
158,抱負を伺いたいと思います,豊富を伺いたいと思います,12,2
159,ファンの人は立ち入り禁止ですよ,ファンの人は立ち入り禁止ですよ,15,0
160,柔軟性があるって事じゃないですか,柔軟性があるってことじゃないですか,16,2
161,車まで乗せていただいて,車までのせていただいて,11,1
162,それはアリバイでも何でもないぞ,それはありバイデもなにでもないぞ,15,5
163,せっかく優しくしてあげたのに,せっかく優しくしてあげたのに,14,0
164,先生この部屋何か暑くないですか,先生この部屋なにか暑くないですか,15,2
165,リモコンどこいっちゃったんだろう,リモコンドコイっちゃったんだろう,16,3
166,ずっと聞かせてもらったってわけだ,ずっと聞かせてもらったってわけだ,16,0
167,お手柄と言いたいところだがな,お手がらと言いたいところだがな,14,2
168,これが山村ヨウコの細胞,これが山村洋子の細胞,11,3
169,あれならとっくに解析処理を終えた,あれならトックに解析処理を終えた,16,3
170,俺のほうでも調べてみたいんだ,俺の方でも調べてみたいんだ,14,2
171,訓練を受けた張本人ですら,訓練を受けた重本人ですら,12,1
172,耐え切れる者はいません,正駅れるものはいません,11,5
173,一緒にご飯食べるところなの,一緒にごはん食べるところなの,13,2
174,こんな訪ね方しか出来なくて,こんな尋ね方しかできなくて,13,3
175,あるヤツの名前と住所を,あるやつの名前と住所を,11,2
176,そしたら本当にそいつが死んで,そしたら本当にソイツが死んで,14,3
177,やつらにやられっぱなしだ,やつらにやられっぱなしだ,12,0
178,いま少し休ませてるんです,います子し休ませてるんです,12,2
179,再開されることへの恐怖を抱きます,再開されることへの恐怖を抱きます,16,0
180,間もなく彼女は落ちます,間もなく彼女は落ちます,11,0
181,しっかり覚えてほしんだけど,しっかり覚えてほしんだけど,13,0
182,父親のことをあいつに知らせるな,父親のことを愛つに知らせるな,15,2
183,全然落ちねーじゃないか,全然落ちネUじゃないか,11,2
184,予想以上に粘っています,予想以上に粘っています,11,0
185,だったらもっとレベルを上げろ,だったらもっとレベルを上げろ,14,0
186,死んでしまったら二度と手がかり,新でしまったら二度と手がかり,15,2
187,関わらせることは本当に避けたいんだが,かか笑れることは本当に避けたいんだが,18,4
188,あいつらを捕まえるチャンスなんだろ,あいつらを使まえるチャンスなんだろ,17,1
189,テロリスト確保の際に何かあった時は,テロリスト角歩の際に何かあったときは,17,4
190,国を守ることが最優先だ,国を守ることが最優先だ,11,0
191,でもちょっと元気出てきました,でもちょっと元気でてきました,14,1
192,その人に会わせてあげる,その人に合わせてあげる,11,1
193,そんなもんさっきの青い車を,そんな文作器の青いクルマを,13,8
194,捕まえてみればわかるんだよ,つかまえてみれば分かるんだよ,13,3
195,もう少しで大切な証人を,もう少しで大切な承認を,11,2
196,少々強引なところがありまして,少々豪囲なところがありまして,14,2
197,何かいじってないと落ち着かなくて,何かいじってないと落ちつかなくて,16,1
198,自動車販売会社に勤める,自動車販売会社に努める,11,1
199,現場に争った形跡がなかったことから,現場に争った形跡がなかったことから,17,0
200,ずいぶん辺鄙なところだな,ずいぶん返秘なところだな,12,2
201,ウイルスを隠しているんだから,ウイルスを隠しているんだから,14,0
202,仲間を引き連れて戻ってくるかもよ,仲間を引き連れて戻ってくるかもよ,16,0
203,下手な心理戦仕掛けやがって,ヘタナシンリ先子掛けやがって,13,8
204,俺たちに何も出来なくさせる,俺たちに何もできなくさせる,13,2
205,今のところ見当たらない,今のところ見あたらない,11,1
206,そんなもんさっきの青い車,そんな文作器の青いクルマ,12,8
207,俺も早く気づくべきだった,俺もはやく気付くべきだった,12,3
208,あんたが犯人だってわかるようになっています,アンタが犯人だってわかるようになっています,21,3
209,言い訳は本部でゆっくりしろ,言い訳は本部でゆっくりしろ,13,0
210,あなたは私たちが言うことを,あなたは私たちが言うことを,13,0
211,ヒーローが犯人の背中に,ヒUロUが犯人の背中に,11,2
212,これからは嘘だって思いなさい,これからは嘘だって思いなさい,14,0
213,それじゃあ最後にもうひとつ頼む,それじゃあ最後にもうひとつ頼む,15,0
214,上空から現場の画定はできません,上空から現場の確定はできません,15,1
215,その後の状況報告お願いします,その後の状況報告お願いします,14,0
216,お互い頑張って生きていきましょうね,お互いがんばって生きていきましょうね,17,3
217,報告が送れてすみません,報告が遅れてすみません,11,1
218,銃を奪われ撃たれました,重を奪われ打たれました,11,2
219,自分の正体がバレたのか,自分の招待がバレたのか,11,2
220,このままの流れで決行だ,このままの流れで結構だ,11,2
221,高木君家にいなかったんだけど,高木君化にいなかったんだけど,14,1
222,こちらの方とも確認してみます,こちらの方とも確認してみます,14,0
223,遥ちゃん今病院なんですけど,はるかちゃんこん病院なんですけど,13,5
224,お兄さんのことすごく心配していて,おいいさんのことすごく心配していて,16,2
225,あちこちに大きいホースが,あちこちに大きいホUスが,12,1
226,今すぐ空調を全部止めて,今すぐ空長を全部止めて,11,1
227,感染したと決まったわけじゃないだろう,感染したと決まったわけじゃないだろう,18,0
228,対テロを専門としている組織だ,タイテロを専門としている組織だ,14,2
229,研究室に戻る気はありません,研究室に戻る機はありません,13,1
230,やっぱり食われたのは宝生,やっぱり下れたのは方省,12,4
231,我々へのウィルステロは失敗だ,われわれへのウィルステロは失敗だ,14,4
232,全員殺すつもりだったの,全員コロスツもりだったの,11,4
233,すぐに出動の要請をする,すぐに出動の要請をする,11,0
234,当たれば高圧電流が流れて,当たれば高圧電流が流れて,12,0
235,どうしたらこの国を救えるのか,どうしたらこの国をスクエルのか,14,4
236,俺にはただずっと側にいてほしい,俺にはただずっと側にいてほしい,15,0
237,これを届けにきてくれたの,これを届けに来てくれたの,12,1
238,あなたに会いたいって言ってるのよ,あなたに合いた言って言ってるのよ,16,2
239,でもこれで追跡は不可能よ,でもこれで追跡は不可能よ,12,0
240,相変わらず気持ちいいほど自分本位,相変わらず気持ちいいほど自分本位,16,0
241,科学捜査などの専門的捜査で,化学捜査などの専門的捜査で,13,1
242,凶悪犯罪に対応していくチムです,共悪犯罪に対応していくちむです,15,3
243,あの女と同期だそうです,あの女と同期だそうです,11,0
244,それに新しい部署の失敗は,それに新しい武書の失敗は,12,2
245,どこの部署からもいらない精鋭たちが,どこの部所からもいらない清栄たちが,17,3
246,容疑者じゃありませんよ,容疑者ジャありませんよ,11,2
247,暴力事件を起こしてましてね,暴力事件を起こしてましてね,13,0
248,どうぞよろしくお願いします,どうぞよろしくお願いします,13,0
249,こんな部署やることないでしょ,こんな部所やることないでしょ,14,1
250,身元不明の焼死体が発見された,実と不明の承死体が発見された,14,3
251,上半身が丸焦げだったようです,上半心が丸子下だったようです,14,3
252,あと片腕が折れていたとか,あとかた腕が折れていたとか,12,2
253,わたし刑事じゃないですから,私慶事じゃないですから,13,4
254,警察といえどもね異動はあるの,警察といえどもね移動はあるの,14,1
255,わたし人間に興味ないんで,私人間に興味ないんで,12,3
256,片桐さんにはお似合いですね,型切りさんにはおに愛ですね,13,6
257,相当手広くやっていたようで,相当ティロクやっていたようで,13,4
258,炭化した内臓が粉砕してた,短化した内蔵が踏ん最してた,12,5
259,着任早で張り切ってんのは分かるが,着人はやでは理近点のはわかるが,16,10
260,鉄塔に登らせた可能性が,鉄頭に登らせた可能性が,11,1
261,じゃあこの着信履歴調べれば,じゃあこの着心理歴調べれば,13,2
262,それからついでに現場で,それから次いでに現場で,11,1
263,それにそんな薬品なんて,それにそんな約品なんて,11,1
264,近どこかと合併するとか,近どこかと形併するとか,11,1
265,業界大手のグロリアス薬品と,業界大手のグロリアス約ヒント,13,4
266,またテレビで報道されると思います,またテレビで報道されると思います,16,0
267,焼死ならそうはいかないわ,少しならそうはいかないわ,12,2
268,わたしがこの目で確認してる,私がこの目で確認してる,13,3
269,指示を受けていたことが分かってる,支持を受けていたことがわかってる,16,3
270,摩擦で爆発するようになっていた,まさつで爆発するようになっていた,15,3
271,つまり一度着たら脱ぐことのできない,つまり一度北なぐことのできない,17,4
272,一番いやなことさせたわけか,一番いやなことさせたわけか,13,0
273,あまり評判のよくない銀行です,あまり評判の良くない銀行です,14,1
274,次の犯行もすぐに起こるわ,次の犯行もすぐに起こるわ,12,0
275,改造したスタンガンが見つかった,解像したスタンガンが見つかった,15,2
276,セットされてる可能性が極めて高い,セットされてる可能性が極めて高い,16,0
277,そういうことだ遊んでる暇はない,そういうことだ遊んでる暇はない,15,0
278,やはり爆弾はセットされてるな,やはり爆弾はセットされてるな,14,0
279,時間なんて気にする必要ない,時間なん的にする必要ない,13,2
280,かなり精密にやらないと,かなり清密にやらないと,11,1
281,ほんのわずか多めにする,ほんのわずかおお目にする,11,3
