567,マスコミには見えないから警察,マスコミには見えないから掲察,14,1
568,ていうか君たちの話聞かせてくれよ,ていうか気味たちの話機化せてくれよ,16,4
569,みんな体面ばっか気にしてる感じですね,みんな大面バッカ機にしてる感じですね,18,5
570,あの子たちちゃんと話さないでしょ,あのこたちちゃんと話さないでしょ,16,1
571,わたしに向いてくれないと困るの,私に向いてくれないと困るの,15,3
572,塾関係者も見ていません,熟還系社も見ていません,11,4
573,出ていった人物もまだ分からん,出ていった人物もまだわからん,14,1
574,でもたぶん彼女は乗ってくる,でもたぶん彼女は乗ってくる,13,0
575,温情と理解をもって当たり,音情と理解を持ってあたり,12,3
576,その心情を傷つけないように,その信情を築つけないように,13,2
577,定規とコンパスで描ける,上義とコンパスで描ける,11,2
578,なんかすごく盛り上がってる,なんかすごくもりあがってる,13,2
579,距離があると盛り上がるけど,距離があると盛り上がるけど,13,0
580,でも殺害そのものは否定してます,でも殺害そのものは否定してます,15,0
581,売られてるのが分かりました,売られてるのがわかりました,13,1
582,わたしも持ってるよこれ,私も持ってるよこれ,11,3
583,証拠隠滅を図ろうとする犯人は,小骨院目をはカロウとする範人は,14,9
584,ものを考えることができる,ものを考えることができる,12,0
585,それで腹を立てたってわけか,それで原を立てたってわけか,13,1
586,やってもらえないかなと思って,やってもらえないかなと思って,14,0
587,緊張状態を見ようとした,金長状態を見ようとした,11,2
588,あなたたちの狙いは最初から,あなたたちの狙いは最初から,13,0
589,じいちゃんたちがやってるから,次いちゃんたちがやってるから,14,1
590,またわたしが疑われてる,また私が疑われてる,11,3
591,今日は色と面白い話があるの,今日は色と面白い話があるの,13,0
592,常温のミネラルウオタを飲むとは,上音のみねらるうおたを飲むとは,15,9
593,そうやって温めるだけで,そうやってあたためるだけで,11,3
594,あおむけをうつぶせってするだけでも,青向けを移ぶせってするだけでも,17,5
595,わたし先生を殺しちゃった,私先生を心ちゃった,12,5
596,ところが思いも寄らずなのか,ところが思いもよらずなのか,13,1
597,あなたは最初乾いた血痕の上から,あなたは最初川多けっこんの上から,15,6
598,さらにその上にまたすぐに,さらにその上にまたすぐに,12,0
599,皮肉にも漂白剤をまいたことで,日に国も表はく剤を舞いたことで,14,7
600,増岡先生のとこが割られてた,ます岡先性のと子が割られてた,13,4
601,何でかなってずっと考えてた,なんでかなってずっと考えてた,13,2
602,増岡先生が付き合ってたのは,ます岡先性が付き合ってたのは,13,3
603,なのにどうして冷静じゃないんだろううって,なのにどうして冷静じゃないんだろううって,20,0
604,気に入ったら後で購入するってやつ,気に入ったらの地で購入するってやつ,16,2
605,由貴を遊んでやったとか,雪を遊んでやったとか,11,2
606,だから思わずそれだけ捨ててしまった,だから思わずそれだけ捨ててしまった,17,0
607,さっきから言ってるよね,さっきから言ってるよね,11,0
608,二宮先生が行っていたという,に飲みや先制が行っていたという,13,5
609,だったら二宮先生じゃん,だったらに飲みや先生ジャン,11,7
610,そういうのが確たる証拠っていうの,そういうのが各タル証拠っていうの,16,3
611,対策室もよくやったじゃん,対策質もよくやったじゃん,12,1
612,出てきたの二宮先生のロッカじゃないよ,出てきたのに飲みや先生のロッカじゃないよ,18,4
613,わたし物覚え悪いから間違ってて,私もの覚え悪いから間違って手,15,5
614,間違えてあなたに伝えちゃった,間違えてあなたに伝えちゃった,14,0
615,先生みたいに奇麗になりたいなと思って,先生みたいにキレイになりたいなと思って,18,3
616,奇麗になれるかなと思って,きれいになれるかなと思って,12,3
617,じゃああのポリグラフも,じゃああのポリグラフも,11,0
618,ほかにも遊んだ女のことも,ほかにも遊んだ女の子とも,12,1
619,今度刑務所から出てくるときは,今度系無所から出てくるときは,14,2
620,でもお前に来た話だから,でもお前に来た話だから,11,0
621,マスコミ向けの広告塔じゃありませんから,マスコミ向けの広告統じゃありませんから,19,1
622,お前だってきちんとメークしてけば,お前だってきちんとメUクしてけば,16,1
623,リラックスして楽しんでいってください,リラックスして楽しんで言ってください,18,1
624,それではよろしくお願いします,それではよろしくお願いします,14,0
625,さらには女性初の室長と,さらには女性初の質張と,11,2
626,俺こういうの苦手なんだけどね,オレこういうの苦手なんだけどね,14,2
627,きちんとできていますので,きちんとできていますので,12,0
628,買ったばかりの育毛剤なんですけど,買ったばかりの行く妄在なんですけど,16,4
629,今日はあの怖い女がいない,今日はあの怖い女がいない,12,0
630,事件解決へとつながってるんですね,事件解決へとつながってるんですね,16,0
631,プライベートは普通の女ですから,プライベUトは普通の女ですから,15,1
632,似たようなもんなんですね,似たようなもんなんですね,12,0
633,この仕事ではよくあることなんです,この仕事ではよくあることなんです,16,0
634,最近の社員はすぐびびっちゃって,最近の社員はすぐびびっちゃって,15,0
635,おそらく大量のアルコールで,おそらく大量のアルコUルで,13,1
636,極秘写真をすっぱ抜いてきた,ごく日写真をすっは犬的た,13,8
637,取り組む姿勢に変わりはない,取り組み姿勢に代わりはない,13,2
638,イケメンもおるのかしら,いけ麺もオルのかしら,11,6
639,まったく不自然な点がない,まったく不自然な点がない,12,0
640,本当に脱がなくていいから,本当にぬがなくていいから,12,1
641,ここでお酒を飲んでいても,ここでお酒を飲んでいても,12,0
642,ましてアルコールに酔って,まして歩コUルによって,12,4
643,そのまさかを追及するのが,そのまさかを追求するのが,12,1
644,何かおったような気がするけどな,何か怒っよような気がするけどな,15,2
645,プライベート中の追い掛けるの,プライベUト中の追いかけるの,14,2
646,事件に関しての続報です,事件に関しての続報です,11,0
647,できるわけないじゃない,できるわけないじゃない,11,0
648,テレビはついてたみたいですけど,テレビはついてたみたいですけど,15,0
649,それからは食いつなぐために,それからはくいつなぐために,13,1
650,こんなのいちいち気にしてたら,こんなの一一気にしてたら,14,4
651,カメラマンとして活動していた,カメラマンとして活動していた,14,0
652,病気にかかり仕事を休んでいたか,病気にかかり仕事を休んでいたか,15,0
653,あの事故死を調べてるんですよね,あの自己しを調べてるんですよね,15,3
654,事故死で片付けられたものを,自己しで片付けられたものを,13,3
655,でも再捜査してよかったですよ,でも最操作してよかったですよ,14,3
656,つまり実際の事件現場に,つまり実際の時県現場に,11,2
657,何かあったらすぐ連絡下さい,何かあったらすぐ連絡下さい,13,0
658,ぱっと見ていい女って思われないと,パッと未定いんなって思われないと,16,6
659,これあなたの読みどおり,これあなたの読み通り,11,2
660,爪の先は面が滑らかなの,つ目の先は面が雨らかなの,11,3
661,こういうささくれは何かに触っていると,こういうささくれは何かに触っていると,18,0
662,第三者の手によって切られた,大三者の手によってきられた,13,2
663,この男ひと月ほど前から,この男一月ほど前から,11,2
664,ただ職業上の接点はない,ただ職業状の設点はない,11,2
665,ストーカー殺人の現場にいたディレクター,ストUカU札人の現場にいたディレクタU,19,4
666,ここに来るまでに迷っちゃった,ここに車でに迷っちゃった,14,3
667,わたしは自分の目で見て,私は自分の目でみて,11,4
668,自分の目で見て確かめたいの,自分の目で見てたしかめたいの,13,2
669,たまたま近くで取材してたから,玉田町角で取材してたから,14,6
670,そろそろ時間だからまた,そろそろ時間だからまた,11,0
671,こちらこそごめんなさい,こちらこそごめんなさい,11,0
672,スクープ映像を解析したものよ,スクUプ映像を解析したものよ,14,1
673,運航していた船のエンジン音,運行していた船のエンジンオン,13,3
674,刃物のようなもので首を刺され,はもののようなもので首を刺され,14,3
675,安田に弱みを握られていて,安田谷和海を握られていて,12,3
676,高峰仁美がお送りしました,高身ね人が大栗しました,12,6
677,死因は現在分かっておりません,死因は現在分かっておりません,14,0
678,とんでもない不祥事だぞ,とんでもない不証示だぞ,11,2
679,君に責任取ってもらわないとな,記味に責任とってもらわないとな,14,3
680,亡くなった男性東郷英憲さんは,なくなった男性統合比で乗りさんは,14,7
681,発見後すぐに助けに入ったかのように,発見後すぐに助けに入ったかのように,17,0
682,映像を一部切り取り編集しました,映像を一部切り取り返集しました,15,1
683,しかし捏造スクープの映像を,しかし熱増スクUプの映像を,13,3
684,カプセルを服用して死んだ,カプセルを福用して死んだ,12,1
685,高峰にカプセル飲ますのは無理やな,高身ねにカプセルのマスのは無理やな,16,5
686,たった今からこのヤマは,たった今からこの山は,11,2
687,上の結論が出るまでお前たちは,上の血論が出るまでお前たちは,14,1
688,ここでおとなしく待ってろ,ここでおとなしくまってろ,12,1
689,俺だってつらいんだからさ,オレだってつらいんだからさ,12,2
690,取り調べ中に人が死んでるんだろう,取り調べ中に人が死んでるんだろう,16,0
691,捜査に決まってるじゃない,捜査に決まってるじゃない,12,0
692,捜査担当から外されたんですってね,捜査担当から外されたんですってね,16,0
693,大変な問題を起こしたんだから,大変な問題を起こしたんだから,14,0
694,こんなもんもらっちゃってねぇ,こんなもんもらっちゃってねぇ,14,0
695,捜査を続行させてほしいってさ,捜査を続行させてほしいってさ,14,0
696,大沢絵里子は首だけどな,大沢エリコは首だけどな,11,3
697,アリバイの裏取ってきました,アリバイの裏取ってきました,13,0
698,そこから分かった新事実が幾つか,そこから分かった新事実がいくつか,15,2
699,まず東郷の体内から出てきた,まず統合の体内から出てきた,13,2
700,生放送前で忙しいんだけど,生放送前で忙しいんだけど,12,0
701,あなたに一番最初に伝えようと思って,あなたに一番最初に伝えようと思って,17,0
702,その日あなたが東郷に青酸カリを,その日あなたが統合に制産かりを,15,6
703,この成分はニトロセルロース樹脂,この西分はにとろせるロUス受止,15,9
704,まず青酸カリ入りのカプセルを,まず生産かり入りのカプセルを,14,4
705,マニキュアのクリアコートでコーティングする,マニキュアのクリアコUトでコUティングする,21,2
706,これで溶けだす時間を調整できる,これでとけだす時間を調整できる,15,1
707,これを服用すると塩酸ロペラミドで,これを復用すると演算ロペラミドで,16,3
708,毒入りカプセルが溶けだし,独入かプセルがとけだし,12,4
709,カプセル剤を飲まなければいけないことを,カプセル材を飲まなければいけないことを,19,1
710,体内に残った成分を計算すると,台内に残った西分を掲算すると,14,3
711,東郷がカプセルを服用したのは,統合がカプセルを復用したのは,14,3
712,それから安田のお風呂場で,それから安田のオフロ場で,12,3
713,優秀なジャーナリストだった,優秀なジャUナリストだった,13,1
714,わたしが大きくならないといけない,私が大きくならないといけない,16,3
715,たとえどんなに小さな声でも,たとえどんなに小さな声でも,13,0
716,生放送中に自白するなんて,生放送中に自泊するなんて,12,1
717,最近残業するようになったらしいね,最近残業するようになったらしいね,16,0
718,そういえば昨日の野立会にも来なかった,そういえば機能ののだ近いにもこなかった,18,7
719,イケメンが集う異業種交流会だ,いけ麺が強うい業種交流会だ,14,6
720,片桐が来ないと戦力にならん,型切りがこないと宣力にならん,13,5
721,まあそんなかりかりするな,まあそんなかりかりするな,12,0
722,また野立会に来なくなる,またのだち近にこなくなる,11,5
723,ヤマムーにウィッグかぶせて,やマムUニィワッグ株セて,13,8
724,殺人を起こしてるヒットマンや,札人を起こしてるヒット万や,14,3
725,今回対立する組織の幹部を,今回対立する組織の幹部を,12,0
726,それに送られてきたこの人形,それに贈られてきたこの人形,13,1
727,小野田班と協力して捜査をする,おのだ半と協力して捜査をする,14,4
728,所持してることには変わりはない,初持してることには変わりはない,15,1
729,最近ライフル弾を購入した人は,最近ライフル段を購入した人は,14,1
730,まだ仕事中なんだけどね,まだ仕事中なんだけどね,11,0
731,彼女は飛びっ切りの美人だから,彼女は飛びっきりの美人だから,14,1
732,銃弾から使われたライフルは,充団から使われたライフルは,13,2
733,おそらく狩猟用のレミントンを,おそらく主料用のレミントンを,14,2
734,スケジュール見ておくから,スケジュUル見ておくから,12,1
735,この人何も分かってない,この人何もわかってない,11,1
736,この人形はおそらくこれから,この人形はおそらくこれから,13,0
737,これは部長クラスしか見れないんだけど,これは部長クラスしか見れないんだけど,18,0
738,呼び出すなよこんな所に,呼び出すなよこんなところに,11,3
739,警視庁幹部が仲悪かったんだ,警視庁幹部がなかわるかったんだ,13,4
740,独自に捜査を進めていたんだ,独自に操作を進めていたんだ,13,2
741,通常の捜査ならあり得ない,通常の操作ならあり得ない,12,2
742,谷本が同じ格好をさせて,他にもとが同じ格行をさせて,11,5
743,警察の動向見るためにな,警察の同校みるためにな,11,3
744,救急車で運ばれたが間もなく,休求者で運ばれたがまもなく,13,4
745,仲間を殺すのはやめるよ,仲間を殺すのはやめるよ,11,0
746,あそこで発砲するのはやむを得ない処置,あそこで発砲するのはやむを得ない所地,18,2
747,ずっと背負っていくしかない,ずっと背覚っていくしかない,13,1
748,例の刑事さんが撃たれたっていうの,例の計示さんが打たれたっていうの,16,3
749,警備しなくちゃいけなくて,警備しなくちゃいけなくて,12,0
750,ターゲットはその誤射事件に関連した,タUゲットはその誤い時県に関連した,17,4
751,これでまた誰かが殺される,これでまた誰かが頃される,12,1
752,関係してる可能性も含め,関係してる可能性も含め,11,0
753,この仕事自体忘れとんちゃうかな,この仕事自体忘れトンちゃうかな,15,2
754,誤って撃たれた武藤さんが,誤って打たれたむ統産が,12,5
755,それに当時女性刑事ばかりを集めて,それに当時女性形示箱を集めて,16,5
756,ライバルの野立が注目されていた,ライバルののだちが注目されていた,15,3
757,組織犯罪を統括する長として,組織犯罪を統括する長として,13,0
758,スタンドを分割して警備を行う,スタンドを分割して警備を行う,14,0
759,本当の黒幕はこいつなのよ,本当の黒幕はコイツなのよ,12,3
760,大げさに吹っ飛びやがってお前,大下さにふっとびやがってお前,14,3
761,別にいいじゃないっすか,別にいいじゃないっすか,11,0
762,もう泣いていい見ないから,もうないていい見ないから,12,1
763,俺たち最強ツートップだ,オレたち最強ツUトップだ,11,3
764,相談する女なんかいません,相談する女なんかいません,12,0
765,どうせまたマスコミ向けに押し付けられた,同セマたマスコミ向けに押し付けられた,19,4
766,僕がまだ交番勤務時代に,ぼくがまだ後版勤務時代に,11,4
767,小野田班はすでに動いている,おのだ判はすでに動いている,13,4
768,君たちも至急捜査に当たってくれ,君たちも支給操作にあたってくれ,15,5
769,前のあれも恋ちゃうちゅうねん,前のあれもコイチャウ中年,14,9
770,デートなんて行かせないよ,デUトなんていかせないよ,12,2
771,木元と花形はわたしと現場に,気元とは長田は私と現場に,13,7
772,片桐は科捜研と連携して,型切りは仮想権と連携して,11,6
773,高いことが分かりました,高いことがわかりました,11,1
774,こう斜めになっていたり,こうなな目になっていたり,11,3
775,複数いることを指してる,複数いることを差してる,11,1
776,傷害と窃盗の前科のある男や,小涯と窃盗の前家のある男や,13,3
777,見慣れてるみたいですね,みなれてるみたいですね,11,2
778,内藤は孤立してたみたいや,内藤はコリツしてたみたいや,12,3
779,もう一度ガイ者周りをあたって,もう一度外社回りを与って,14,6
780,小野田班からの報告がありました,おのだ判からの報告がありました,15,4
781,会ってなく絶縁状態にあるそうです,あってなく絶演状態にあるそうです,16,2
782,子供を置いて逃げるなんて,子どもを置いて逃げるなんて,12,2
783,警察の方とのコミュニケーションは,警察の方とのコミュニケUションは,16,1
784,開設してらっしゃいますが,開設してらっしゃいますが,12,0
785,個別に相談がある場合は,個別に相談がある場合は,11,0
786,追い込んでしまうことが多いんです,おい込んでしまうことが多いんです,16,1
787,いつか父親に認められたい,いつか地治やに認められたい,12,3
788,愛されたいと願っていました,愛されたいと願っていました,13,0
789,先客がいたみたいだから,先客が痛みたいだから,11,2
790,一歩も外には出なかったと言っていました,一歩も外には出なかったと言っていました,19,0
791,現場の土が車内から出るはずだから,現場の度が社内から出るはずだから,16,2
792,ということは証言は本当か,ということは正現は本当か,12,2
793,とにかくお前はおとなしくしてろ,とにかくお前は音なしくしてロ,15,3
794,ジョギング中の女性が発見しています,ジョギング中の女性が発見しています,17,0
795,ナイフでのど元を一撃された後に,ナイフでのドモトを一撃された後に,15,3
796,むちゃくちゃな殺し方だが,無ちゃくちゃな頃仕方だが,12,3
797,後始末だけはしっかりしている,あとしまつだけはしっかりしている,14,5
798,マスコミにたたかれるんだ,マスコミに戦れるんだ,12,3
799,マスコミ対応の方もばっちりやって,マスコミ対応の方もばっちりやって,16,0
800,じゃそのサイト閲覧者が,ジャソのサイト閲覧者が,11,3
801,そのメールを見られる全ての人間が,そのメUルを見られるすべての人間が,16,3
802,年齢も虐待方法も親父そっくりだ,年齢も逆滞方法も親時速陸だ,15,7
803,警視庁の大沢絵里子です,警視庁の大沢エリコです,11,3
804,それで一応先生の事件当日の,それで一応先生の事件当日の,13,0
805,その時間はわたし寝ていましたから,その時間は私ねていましたから,16,4
806,この現場から宮川さんの自宅は,この現場から宮川さんの自宅は,14,0
807,宮川さんは鋭利な刃物で,宮川さんは映理なはもので,11,5
808,現場に残された靴跡ですが,現場にの子された靴都ですが,12,3
809,そんなことあるわけないですよ,そんなことあるわけないですよ,14,0
810,その時間は教授室にいました,その時間は教授室にいました,13,0
811,共有パソコンにカメラ付いてるから,共有パソコンにカメラツいてるから,16,1
812,前後の日も含めて終日全部,前後の日も含めて週日全部,12,1
813,ただ捜査を混乱させるだけだから,ただ操作を混乱させるだけだから,15,2
814,だったら最後に一緒にやろうよ,だったら最後に一緒にやろうよ,14,0
815,父親にひどい虐待を受けていた,父親にひどい逆滞を受けていた,14,2
816,狭い押し入れの中に閉じ込められた,狭い押し入れの中に飛じ込められた,16,1
817,そんな毎日が何年も続いた,そんな毎日が何年も続いた,12,0
818,立ち直ることができなかった啓介さんは,立ち直ることができなかった系付けさんは,18,3
819,それを発見したあなたは,それを発見したあなたは,11,0
820,押し入れに閉じ込められて,押し入れにと自己メラれて,12,5
821,直接的な表現がいいかも,直接的な表現がいいかも,11,0
822,気付かないでいたなんて,気付かないでいたなんて,11,0
823,教授室に入ったときには,教授室に入った時には,11,2
824,利き手が変わることはまれではないの,聞き手が変わることはまれではないの,17,1
825,これは自分に起こってることではないと,これは自分に起ってることではないと,18,1
826,思い込んでしまったのね,思い込んでしまったのね,11,0
827,たくさん救ってきたのは事実です,たくさんすくってきたのは事実です,15,2
828,啓介さんの人格ではなく,系少さんの人格ではなく,11,2
829,何か切なくなっちゃったな,何か設なくなっちゃったな,12,1
830,ちょっと大事なこと言いに来た,ちょっと大事なこといいに来た,14,1
831,女性への関心は極めて強いが,女性への鑑心は極めて強いが,13,1
832,お前ら今消しゴム盗んだろうう,お前らいまけしごむぬすんだろうう,14,7
833,だからお母さん駄目ですって,だからお母さんだめですって,13,2
834,講習やってるんですから,講習やってるんですから,11,0
835,対策室の面々は人が足りない,対策質の面面は人が足りない,13,2
836,何でわたしが小学生相手に,なんで私が小学生相手に,12,5
837,俺が謹慎処分ってことで,オレが金新処分ってことで,11,4
838,逆に矛先をかわしたんだよ,逆にほこ先をかわしたんだよ,12,2
839,手伝ってもらうつもりだったけど,鉄だってもらうつもりだったけど,15,2
840,駅前広場に設置された爆弾が,駅前広場に設置された爆弾が,13,0
841,まあ取り調べるしかないやろ,まあ取り調べるしかないやろ,13,0
842,岩井と片桐は被疑者の取り調べ,岩いと語分りは議議者の取り調べ,14,6
843,かみつかれないようにね,か見つかれないようにね,11,1
844,俺の耳に入ってくるはずだぞ,オレの耳に入ってくるはずだぞ,13,2
845,ごみ箱蹴ったのと今回の事件と,ゴミバコケったのと今回の事件と,14,5
846,それを切り出すタイミング,それを切り出すタイミング,12,0
847,こいつは俺の大学の後輩だ,こいつはオレの大学の後輩だ,12,2
848,だがまだ確証がつかめない,だがまだ各小がつかめない,12,2
849,あれも汚職の発覚を恐れた,アレもお食の発覚を恐れた,12,4
