282,それも何度かやってみないと分からない,それもなんどかやってみないとわからない,18,4
283,戸倉さんにお聞きしました,と暮らさんにお聞きしました,12,3
284,何から何まで教えていただきました,何から何まで教えていただきました,16,0
285,嘘は絶対に言ってはならない,嘘は絶対に行ってはならない,13,1
286,今爆弾処理班が向かっています,今爆弾処理ハンガム買っています,14,5
287,もう少し待てばよかったんだよ,もう少しまてばよかったんだよ,14,1
288,言わせるために作ったんだって,岩瀬瑠タメに作ったんだって,14,6
289,それはわたしが優秀だからです,それは私が優秀だからです,14,3
290,ここは誰も教えてくれないからな,ここは誰も教えてくれないからな,15,0
291,あののっぽと付き合ってる男,あののっぽと付き合ってる男,13,0
292,現実的にはそうかもしれない,現実的にはそうかもしれない,13,0
293,でも撃てなきゃ刑事じゃない,でもうてなきゃ刑事じゃない,13,1
294,お前のこと色々噂になってるぞ,お前のこと色い労和さになってるぞ,14,4
295,さっき台東区で女子大生が,さっきたいとうくで女子大生が,12,5
296,共に地取り鑑取りを行っていますが,とも日取館取りを行っていますが,16,5
297,問題はこのインターネットの掲示板,問題はこのインタUネットの掲示板,16,1
298,また一人処刑してやった,また一人初刑してやった,11,1
299,一人目の処刑者よしおかひとみ,一人目の初刑者よしおか人み,14,3
300,殺人犯を英雄視してるんだ,殺人反を永優ししてるんだ,12,4
301,書き込みの情報によると,書き込みの情報によると,11,0
302,巨大なダガーナイフを持ち,巨大なダガUナイフを持ち,12,1
303,そのマークを現場にも残す,そのマUクを現場にも残す,12,1
304,総合するとこんな感じです,総合するとこんな感じです,12,0
305,インターネットのデマじゃない,インタUネットのでまじゃない,14,3
306,共に頑張ろうぜおっさん,ともに頑張ろうぜおっさん,11,2
307,ちょっと調べてほしいことがあるんです,ちょっと調べて欲しいことがあるんです,18,1
308,大事件に発展するかもしれないんです,大事件に発展するかもしれないんです,17,0
309,吉岡さんはお酒を飲んだ,親岡さんはお酒を飲んだ,11,1
310,ベッドの脇に落ちたことによる,ベッドの脇に落ちたことによる,14,0
311,現場にばってんマークとか,現場にバッテンマUクとか,12,5
312,そんなやつおるわけないやろ,そんなやつあるわけないやろ,13,1
313,全てフリースペースに置いてある,すべてフリUスペUスにおいてある,15,5
314,それぞれの所轄に連絡させて,それぞれの初家つに連絡させて,13,3
315,同じ人間が書き込みしてるようです,同じ人間が書き込みしてるようです,16,0
316,このインターネットに参加している全員が,このインタUネットに参加している全員が,19,1
317,でも彼女は服の上からだった,でも彼女は服の上からだった,13,0
318,神なんて祭り上げられて,上なんてまつり上げられて,11,3
319,ぺらぺらしゃべっていたそうだな,ペラペラシャベっていたそうだな,15,7
320,その口の軽さで逮捕できたよ,その口のカルさで逮捕できたよ,13,2
321,逮捕されたのは都内に住む,逮捕されたのは都内に住む,12,0
322,捕まった奴は神なんかじゃない,つかまったやつは上なんかじゃない,14,5
323,親御さんからは頑張れば,親ご参からはがんばれば,11,6
324,傷つくこともないんだもんね,傷つくこともないんだもんね,13,0
325,だから何が言いたいんだって,だから何が言いたいんだって,13,0
326,塀の向こうに落ちた神様,ヘイの向こうに落ち高み様,11,4
327,インターネットは祭りよ,インタUネットはまつりよ,11,3
328,まだ連絡の取れなかった,まだ連絡の取れなかった,11,0
329,気力があればなおさら危険ですね,気力があればなおさら危険ですね,15,0
330,インターネットの書き込みの,インタUネットの書き込みの,13,1
331,本当の怪物を生んでしまった,本当の回仏を産んでしまった,13,3
332,面白がった誰かが名前を書き込む,面白がった誰かが名前を書き込む,15,0
333,その期待に応えようとするはず,その機待に応えようとするはず,14,1
334,一刻も早く逮捕しなければ,一国も早く逮捕しなければ,12,1
335,それぞれ保管室に行って,それぞれ保管室に行って,11,0
336,拳銃を携行していくように,拳銃を傾向していくように,12,2
337,もうちょっといい写真使いなさい,もうちょっといい写真使いなさい,15,0
338,護衛捜査員はこれから選出する,ごえい操作員はこれから選出する,14,5
339,一刻も早く発表したいらしいから,一国もは約発表したいらしいから,15,3
340,あっけない最期でしたね,あっけない最後でしたね,11,1
341,この犯人だけがインターネット上の神を,この犯人だけがインタUネット上の紙を,18,2
342,つまりとっくに死んでる遺体に,つまりトックにシンデルいたいに,14,10
343,今は中がジッパーになってる,今は中がジッパUになってる,13,1
344,インターネットのオークションで買った,インタUネットのオUクションで買った,18,2
345,近くのホームレスの男性,近くのホUムレスの男性,11,1
346,また飲み会してくださいね,またのみ会してくださいね,12,1
347,早う家帰って風呂入って,は用言え帰ってフロは言って,11,8
348,でも浩のおかげで助かった,でも広のお陰で助かった,12,3
349,今度は朝まで付き合ってよ,今度は麻様で付き合ってよ,12,2
350,きっと人間と見てないよ,きっと人間と見てないよ,11,0
351,大変申し訳ありませんでした,大変申し訳ありませんでした,13,0
352,同じ雑誌の読者モデルが,同じ雑誌の読者モデルが,11,0
353,まだ犯人の手掛かりはつかめていない,まだ犯人の手がかりはつかめていない,17,1
354,少し離れて歩きますから,少し離れてある気ますから,11,3
355,今日はありがとうございました,今日はありがとうございました,14,0
356,ぜひまた次回も呼んでください,ぜひまた次回も呼んでください,14,0
357,ただこういったケースの場合,ただこういったケUスの場合,13,1
358,ゆっくり落ち着いてからの方が,ゆっくり落ち着いてからの方が,14,0
359,ブランドの新作発表会の帰り道,ブランドの新作発表会の帰り道,14,0
360,あまりしゃべりたがらない,あまりしゃべりたがらない,12,0
361,話をしたくない人もいるの,話をしたくない人もいるの,12,0
362,被害者は深く傷ついてる,被害者は深く傷ついてる,11,0
363,わたし樋口さんに嫌われたみたいです,私ひ口さんに嫌われたみたいです,17,4
364,読者モデルとはいっても,読者モデルとは言っても,11,1
365,直接入っていたそうです,直接は言っていたそうです,11,2
366,覚せい剤で逮捕歴もある,覚せ製材で逮捕歴もある,11,2
367,定時だから帰っていいわ,提示だから帰っていいわ,11,2
368,刑務所から出したはがきや封筒には,刑務所から出したはがきや風当には,16,2
369,事件の概要が見えてきました,事件の概要が見えてきました,13,0
370,これ樋口さんからもらったんだ,これひ口さんからもらったんだ,14,1
371,もっと色々もらってこよう,もっといろいろもらって雇用,12,7
372,たぶんどこかで手足を縛られ,たぶんどこかで手足をしばられ,13,2
373,これは傷つけても構わないという,これは傷つけてもかまわないという,15,2
374,ナイフを押し付けられていた,ナイフを押し付けられていた,13,0
375,平手で殴られてるから傷も浅い,平手で殴られてるから傷も朝い,14,1
376,三上とは同じ中学の先輩後輩で,三神とは同じ中学の先輩後敗で,14,2
377,三上の働いてるバーに呼びつけられて,三上の働いテルバUに呼びつけられて,17,3
378,少し話が聞きたいんですが,少し話しが聞きたいんですが,12,1
379,まあちょっとそこでお茶でも飲みながら,まあちょっとそこでお茶でも飲みながら,18,0
380,コップに付いた唾液から,コップについただ駅から,11,3
381,変なことしゃべってんだったら,変なことしゃ別点だったら,14,4
382,犯人とみて間違いないな,犯人とみて間違いないな,11,0
383,プリンターで出力した文字です,プリンタUで出力した文字です,14,1
384,プリンターのメーカーが同じだと,プリンタUのメUカUが同じだと,15,3
385,字体では区別がつかない,自体では区別がつかない,11,1
386,ゆかりさんの家族構成から出身地,床里さんの家族構成から出身地,15,3
387,病院で会話したこと全部書いてあるんだ,病院で買いわしたこと全部書いてあるんだ,18,3
388,同じ銀行に口座作っちゃおう,同じ銀行に口雑クッチャオウ,13,7
389,犯人の声とにおいを確認してもらう,犯人の声とにおいを確認してもらう,16,0
390,襲われたらどないするつもりじゃ,襲われたらどないするつもりじゃ,15,0
391,だったら樋口さんに頼むわ,だったら樋口さんに頼むわ,12,0
392,女の敵は許したくないんです,女の敵は許したくないんです,13,0
393,金田は毎日決まった時間に,カネダは毎日決まった時間に,12,3
394,警視庁の片桐と申しますが,警視庁の型切りと申しますが,12,3
395,だから全員やってやろうと思って,だから全員やってやろうと思って,15,0
396,家宅捜索の令状も取りました,型く操作料の零上も取りました,13,7
397,必ず証拠は出てくるはずです,必ず証拠は出てくるはずです,13,0
398,あなたはモデル仲間の佐藤さん,あなたはモデル仲間の佐藤さん,14,0
399,そこでバーで知り合った三上に,そこでバUで知り合った三上に,14,1
400,一方的にあなたに愛情を向けていた,一方的にあなたに愛情を向けていた,16,0
401,後ろから危険が訪れるとは,後ろから危険が訪れるとは,12,0
402,あなたはため息をついた,あなたはため息をついた,11,0
403,相手が目の前にいるうちは,相手が目の前にいるうちは,12,0
404,なかなか証拠が挙がらなかった,なかなか証拠が上がらなかった,14,1
405,金田を監視するためにね,カネダを監視するためにね,11,3
406,何にも見つからなかった,何にも見つからなかった,11,0
407,いくら大事な仕事のためとはいえ,いくら大事な仕事のためとはいえ,15,0
408,いずれにせよ家宅捜索すれば,いずれにせよかたく操作すれば,13,5
409,ほかにも証拠は出てくるはず,ほかにも証拠は出てくるはず,13,0
410,全部罪かぶってくれたのに,全部在化ぶってくれたのに,12,2
411,復活できるとこだったのにな,復活できるとこだったのにな,13,0
412,やっぱり直感は正しかったわ,やっぱり直感は正しかったわ,13,0
413,あんなの持たないでしょ,あんなのも棚位でしょ,11,4
414,卑劣な犯罪者の敵がわたしなの,開列犯罪者の適が私なの,14,7
415,警視庁に来てもらうから,警視庁に来てもらうから,11,0
416,マスコミいっぱい来るんでしょ,ます小み一杯くるんでしょ,14,9
417,君にあれはね昆虫を見る目だよ,君にあれは猫中を見る目だよ,14,3
418,ある意味カッコ良かったですよ,ある意味かっこよかったですよ,14,4
419,同情するなら毛根をくれ,同上するなら猛困をくれ,11,3
420,何か感づかれるんじゃないかって,何か管づ彼るんじゃないかって,15,3
421,樋口ゆかりを狙ってること,日口床を狙ってること,12,4
422,自分の考えを全部は言わない,自分の考えを全部は言わない,13,0
423,本当は真実にあげたかったんだよ,本当は新実に挙げたかったんだよ,15,2
424,やっぱりちゃんと考えてるんだあなたも,やっぱりちゃんと考えてるんだあなたも,18,0
425,アピールする狙いもある,アピUルする狙いもある,11,1
426,あなたの後ろには私達がいる,あなたの後ろには私たちがいる,13,2
427,みんなに防犯というものを,みんなに防犯というものを,12,0
428,知ってもらうためにやって来ました,知ってもらうためにやってきました,16,1
429,絶対にドアを開けてはいけません,絶対にドアを開けてはいけません,15,0
430,不測の事態の対処法です,不足の事態の対処法です,11,1
431,やっぱりあたし無理です,やっぱり当たし無理です,11,1
432,仕事に対する姿勢の問題,仕事に対する姿勢医の問題,11,1
433,家で好きなだけ寝ていなさい,家で好きなだけ寝ていなさい,13,0
434,木元さんが大変なんですよ,基元さんが大変なんですよ,12,1
435,こちらから連絡するまで,こちらから連絡するまで,11,0
436,誠に申し訳ありませんが,誠に申し訳ありませんが,11,0
437,電話をお受けすることができません,電話を追うせることができません,16,4
438,いやになったんでしょう,嫌になったんでしょう,11,2
439,社会人としてあるまじき行為,社会人としてある生き効動,13,4
440,プロの自覚がない人間は,プロの時格が無い人間は,11,3
441,とにかく真美りんだけは絶対ダメ,とにかくマミリンだけは絶対だめ,15,6
442,部下の人生をもてあそぶ,部下の人生をもて遊ぶ,11,2
443,現在ガイシャの身元の割り出し中です,現在外者のみもとの割出し中です,17,8
444,ただのチンピラ同士の喧嘩だ,ただのチンピラ同氏の検果だ,13,3
445,使われた拳銃はフィリピンルートで,使われた拳銃はフィリピンルUトで,16,1
446,事件ではないと思いますが,事件ではないと思いますが,12,0
447,それはこちらが決めますので,それはこちらが決めますので,13,0
448,これシュークリーム持ってきました,これシュUクリUムもってきました,16,3
449,そんなに時間はかからないと思うわ,そんなに時間はかからないと思うわ,16,0
450,そういえば木元のやつって,そういえばキモとのやつって,12,3
451,土佐犬より気が強いです,と再縫より気が強いです,11,3
452,あの子も相変わらずだな,あの子も相変わらずだな,11,0
453,少量の塩素酸イオンが含まれていた,少量の演素参い音が含まれていた,16,5
454,昨日から連絡つかなくってさ,機能から連絡つかなくってさ,13,2
455,自宅に電話させてもらいました,自宅に電話させてもらいました,14,0
456,錦糸町のパブで働いてるんだけど,金島町のパブで働いてるんだけど,15,2
457,このままだと電気も止められる,このままだと電気求められる,14,2
458,ただいま留守にしております,ただ今するにしております,13,4
459,今回も身元の分かる物は,今回も見元の分かるものは,11,3
460,被害者の自転車にぶつかった,被害者の自転車にぶつかった,13,0
461,同じメッセージを残してる,同じメッセUジを残してる,12,1
462,こういうメッセージを残したりはしない,こういうメッセUジを残したりはしない,18,1
463,木につるし上げたと考えられる,機にする仕上げたと考えられる,14,3
464,これらのことから犯人は,これらのことから犯人は,11,0
465,激しいスポーツをやっていて,激しいスポUツをやっていて,13,1
466,社会生活はきちんとこなしていて,社会生活はきちんとこなしていて,15,0
467,まだ犯行は続く可能性が高い,まだ犯行は続く可能性が高い,13,0
468,戻ってるんじゃないかと思って,戻ってるんじゃないかと思って,14,0
469,ああいうのに入ったりして,ああいうのに入ったりして,12,0
470,派手にはしゃいでいました,はでには社位でいました,12,5
471,貼っていったものがありますけど,張っていったものがありますけど,15,1
472,免許証はホームレスから名義を買った,綿拠賞はホUムレスから明義を買った,17,5
473,殴る蹴るで殺したちゅう事件や,ナグルケルで殺したちゅう事件や,14,5
474,当時話題になった事件です,当時話題になった事件です,12,0
475,何人かでやったんだよな,何人かでやったんだよな,11,0
476,それからリンチ殺人で殺された,それからリンチ冊人で殺された,14,1
477,見張り役だった男がいるんです,未は利益だった男がいるんです,14,4
478,ゲームセンターで遊んでいた,ゲUムセンタUで遊んでいた,13,2
479,センター裏に連れ出し数発殴った,センタU裏につれ出し数はつなぐった,15,6
480,廃墟で両手足を縛ったうえで監禁,背居で両手足をしばった上で管金,15,8
481,一部をインターネットで流した,一部をインタUネットで流した,14,1
482,その後江川さんは全身打撲による,その後上川さんは全身だ僕による,15,3
483,自殺に見せかけようとしたが,自殺に見せかけようとしたが,13,0
484,このときの警察の対応に,このときの警察の対応に,11,0
485,不自然なタイヤ痕を見つけた,不自然なタイヤコンを見つけた,13,2
486,何もせずに見殺しにした,何もせずに見ごろしにした,11,2
487,新しいメールが来てます,新しいメUルが来てます,11,1
488,海外のサーバーから経由しています,海外のサUバUから敬由しています,16,3
489,今科捜研がしらべてるだけど,今夏総研が調べてるだけど,13,4
490,拉致されているのは警視庁の刑事です,拉致されているのは形視長の刑事です,17,2
491,こっちに回すようにした,こっちに回すようにした,11,0
492,あの防犯キャンペーンのやつ,あの防犯キャンペUンの奴,13,3
493,国民の税金使ってあんな遊びして,国民の税金使って案な遊びして,15,2
494,お前らが許せないんだよね,おまえらが許せないんだよね,12,2
495,映像見ればわかるでしょ,映像見ればわかるでしょ,11,0
496,指揮権は大沢にしましょう,識券は大沢にしましょう,12,3
497,きわめて危険なマル被です,極めて危険なまる日です,12,5
498,病院跡から連れ出されて,病院あとからつれ出されて,11,3
499,インターネットの書き込みチェックと,インタUネットの書き込みチェックと,17,1
500,特別犯罪対策の岩井だけど,特別犯罪対策の岩田けど,12,2
501,調べてほしいことがあるんや,調べて欲しいことがあるんや,13,1
502,逃げられそうで逃げられない,逃げられそうで逃げられない,13,0
503,絶望で木元の気力が萎える事,絶望でき元の寄力が鳴えること,13,5
504,犯人もそれを狙っている,犯人もそれを狙っている,11,0
505,付けてって言ったんだから早く付けてよ,付けてっていったんだから早くつけてよ,18,2
506,交換条件を持ち出し攻めに転じる,交換条件を持ち出しぜメニ天じる,15,4
507,だったらいくらなら用意出来る,だったらいくらなら用意できる,14,2
508,ストレスレベルも相当高い,ストレスレベルも相当高い,12,0
509,不自然なノイズがずーっと入ってる,不自然なノイズがズUットは言ってる,16,6
510,学校でも問題児だったようです,学校でも問題じだったようです,14,1
511,証言を何人もしています,証言を難認もしています,11,2
512,通話の記録ぐらい残っとるやろ,通話の記録ぐらいのこっとるやろ,14,2
513,警視庁の野立が頼んでるって,警視庁ののだちが他ノンデルって,13,8
514,みなさんで分けてください,皆さんでわけてください,12,3
515,自己資金もふんだんに使ってる,自己資金も分断に使ってる,14,4
516,木元を水槽に入れたのも,基元を水槽に入れたのも,11,1
517,警察をからかって楽しんでる,警察をから買って楽しんでる,13,1
518,高倉山じゃないかという,高くらやまじゃないかという,11,4
519,一度は溺死までさせられかけてる,一度はで規島でさせられかけてる,15,3
520,ボスが来ないと面白くないじゃん,ボスが来ないとおもしろくないじゃん,15,4
521,まあ確かにそんな感じだな,まあ確かにそんな感じだな,12,0
522,どこにでも丸腰で行くわ,どこにでもマルゴシでいくわ,11,5
523,みんな付いてるそれ忘れないで,みんなついてるそれ忘れないで,14,1
524,ストレスレベルが上がった,ストレスレベルが上がった,12,0
525,これが当時の通報の録音テープや,これが当時の通報の録音テUプや,15,1
526,普通のことに興味がなくて,普通のことに興味がなくて,12,0
527,でも大人になったら個性ですよ,でも大人になったら個性ですよ,14,0
528,科捜研総動員で解析してもらって,仮想検想動員で解析してもらって,15,4
529,仲間なんて全然当てにならないだろう,仲間なんて全然当てにならないだろう,17,0
530,そんなことやっておもしろいのかよ,そんなことやっておもしろいのかよ,16,0
531,友達がリンチされているんです,友だちがリンチされているんです,14,2
532,俺は色々調べて勉強して,俺はいろいろ調べて勉強して,11,4
533,少年院から出てきやがった,少年員から出てきやがった,12,1
534,毎年祝ってやがったんだ,毎年岩手屋がったんだ,11,4
535,小学校の同級生田島しんごです,小学校の同級生渡マシンゴです,14,5
536,彼も久保からいじめを受けています,彼も久保からいじめを受けています,16,0
537,木元さんガールスカウトにいたから,基元さんガUルスカウトにいたから,16,2
538,あいつ諦めてなかったんや,あいつあきらめてなかったんや,12,3
539,何も出来ないまま目の前で,何もできないままめの前で,12,3
540,仲間が死んでいく辛さを味わってくれ,仲間が死んでいくつらさを味わってくれ,17,2
541,卑怯なのはあなたじゃない,日興なのはあなたじゃない,12,2
542,それは今でも変わらない,それは今でも変わらない,11,0
543,俺はな強くなったんだよ,オレは夏よくなったんだよ,11,4
544,これはフロイトの言う反復脅迫,これはフロイトのいう反復強はく,14,4
545,公開された上で殺されている,公開された上で殺されている,13,0
546,江川君と同じ雪辱を味わってくれ,えが枠と同じ節辱を味わってくれ,15,4
547,時限装置を押す時ためらったじゃん,次限装置を押すときためらったじゃん,16,3
548,今の私はあなたとは違う,今の私はあなたとは違う,11,0
549,あいつらと同じことしてどうする,あいつらと同じことしてどうする,15,0
550,あんたも病院に行かなきゃ,アンタも病院に行かなきゃ,12,3
551,あの劇の帰り道いきなり,あの劇の帰り道いきなり,11,0
552,部下が犯罪に巻き込まれても,部下が犯罪に巻き込まれても,13,0
553,警察官の拉致監禁の容疑で,警察官の拉地間金の容疑で,12,3
554,せっかく僕のクビも免れたんだし,せっかく僕の首も間抜かれたんだし,15,5
555,今朝は朝までいたのにねー,下さは麻までいたのにネU,12,5
556,さっき整理したら出てきた,作帰整理したら出てきた,12,3
557,終いにはあいつが平助さんが,終わり位には相次が平すけさんが,13,8
558,それとも平助さんがあいつなのか,それとも平すけさんが相次なのか,15,5
559,何とぞ穏便にと言ってきてる,何とぞオンビンにといってきてる,13,5
560,とどめの一撃を受けるまで,とど目の一撃を受けるまで,12,1
561,鉄あるいはスチル製のものだとしか,鉄あるいはスチル製のものだとしか,16,0
562,指紋は全てふき取られていた,氏文はすべて吹き取られていた,13,5
563,手を付けられた形跡がないため,手をつけられた形跡がないため,14,1
564,プラス相当頭の切れる人物,プラス相当頭の切れる人物,12,0
565,木元とわたしはまず現場に,木元と私はまず現場に,12,3
566,犯行があったと思われる,犯行があったと思われる,11,0
567,マスコミには見えないから警察,マスコミには見えないから警察,14,0
