850,必死なやつらが上層部にいる,必死悩つらが上装部にいる,13,3
851,犯人の意図が分かりません,犯人の糸がわかりません,12,3
852,取り調べの緩急をだいぶ学んだようね,取り調べの環急を第部まなんだよね,17,6
853,関係があるのは彼じゃない,関係があるのは彼じゃない,12,0
854,当然実験に使うものだと思い,当然実験に使うものだと思い,13,0
855,本人はそれをかたくなに否定してる,本人はそれを片くなに否定してる,16,2
856,その兄の置き時計を使って,その兄の起き届計を使って,12,2
857,リーダーはじめ主要な幹部が,リUダUはじめ主要な幹部が,13,2
858,本当に刑事だったんだな,本当に掲示だったんだな,11,2
859,それを探るために俺と付き合ってたなんて,それを探るためにオレと付き合ってたなんて,19,2
860,新たな情報があるそうだ,新たな情報があるそうだ,11,0
861,だんだん多くなってるんですよね,段んだいこくなってるんですよね,15,3
862,講義をしていた教授は無事でした,抗議をしていた教授は無事でした,15,2
863,黒い月との関係は出てきてません,黒い月との関係は出てきてません,15,0
864,シャッターの修理に参りました,シャッタUの修理に参りました,14,1
865,こちらサインの方お願いします,こちらさんんの放お願いします,14,4
866,本当の威力は分からない,本当の威力はわからない,11,1
867,これ当時の直接の指揮官は,これ当時の直接の指揮官は,12,0
868,情報のご提供が欠かせません,情報のご提供が欠かせません,13,0
869,つきましては捜査にご協力,月ましては操作にご協力,12,4
870,感謝状を差し上げたいと思います,感謝場を差し上げたいと思います,15,1
871,ぶち当たったかもしれませんよ,部知あたったかもしれませんよ,14,3
872,黒い月のターゲットはそのホールなのよ,黒い月のタUゲットはそのホUルなのよ,18,2
873,こっちにも爆弾があります,こっちにも爆断があります,12,1
874,大学の講義室を狙ったのも,大学の抗議質を狙ったのも,12,3
875,全警備をこっちに回してくれ,全警備をこっちに回してくれ,13,0
876,目的じゃなかったとしたら,目的じゃなかったとしたら,12,0
877,大山警視総監になってから,大山景士総館になってから,12,3
878,プールしていたと思われる,プUルしていたと思われる,12,1
879,予算運営部は使えなくなった,予算運営部は使えなくなった,13,0
880,また狙われるかもしれないから,また狙われるかもしれないから,14,0
881,その格好で会場に入った,その格好で会場に入った,11,0
882,君たちの指揮権を持つことになった,君たちの式件を持つことになった,16,3
883,君たちには働いてもらう,君たちには働いてもらう,11,0
884,もしかしたらそのころから,もしかしたらその頃から,12,2
885,警察幹部の妨害があったのかも,警察幹部の防害があったのかも,14,1
886,その程度の嘘しかつけねえようじゃ,その程度脳子しか付け値栄うじゃ,16,6
887,わたし根が正直だから嘘つけないの,私ねが正直だからうそ付けないの,16,7
888,逮捕のときにたっぷりと,逮捕の時にタップリト,11,7
889,果たせへんかったけどな,はたせ変化ったけどな,11,4
890,そのすきに乗じるつもりや,その好きに上じるつもりや,12,2
891,これが仕掛けられた爆弾,これが仕掛けられた爆弾,11,0
892,あなたしか分かる人がいないと思います,あなたしかわかる人がいないと思います,18,1
893,事件解決のためなら頭を下げる,事件解決のためなら頭を下げる,14,0
894,それがわたしのプライド,それが私のプライド,11,3
895,この前もお前にはだまされた,この前もお前にはだまされた,13,0
896,お茶でも飲みながらゆっくりやりましょう,お茶でも飲みながらゆっくりやりましょう,19,0
Total CER: 1978/12057=0.16,,,,
