NUM,EXPECTED,model_epoch_05_gs_36876_beam_width_1,# characters,edit distance
1,ずっと先のことだけどね,ずっと先のことだけどね,11,0
2,おなか減って死にそうだよ,お腹返鉄にそうだよ,12,6
3,水野先生がおっしゃったように,水の先生がおっしゃったように,14,1
4,治療法が見つかるかもしれない,治療法が見つかるかもしれない,14,0
5,お母さん代わってあげられなくてごめんね,お母さんかわってあげられなくてごめんね,19,1
6,お前がそんなことでどうすんだよ,お前がそんなことで同寸だよ,15,4
7,あいつはそんなヤワじゃねえよ,あいつはそんなやわじゃねえよ,14,2
8,あいつが折れそうになったら,相次がおれそうになったら,13,4
9,弘樹もここしょうゆついてる,広きもここしょうゆついてる,13,2
10,わたしの世界はまるで変わってしまった,私の世界はまるで変わってしまった,18,3
11,後ろから答案用紙集めて,後ろから東案洋子集めて,11,3
12,今年遊んどかないともう遊べないよ,今年遊どどかないともう遊べないよ,16,1
13,アクアトピアに乗りたい,悪あとピアに乗りたい,11,4
14,女ってよくしゃべんなあと思って,女って良く者弁なあと思って,15,5
15,カメの餌やりとか金魚の餌やりとか,カメの餌やりとか金魚で餌やりとか,16,1
16,そんなの誰かに頼めばいいじゃない,そんなの誰かに頼めばいいじゃない,16,0
17,薬の効果やリハビリの方法を,薬の高華やりはビリの方法を,13,4
18,確認したいと思ってます,確認したいと思ってます,11,0
19,こんなふうに毎日少しずつ,こんな風に毎日少しずつ,12,2
20,何かができなくなっていくの,何かができなくなっていくの,13,0
21,目を閉じて次の日が来るのがこわい,目を閉じて次の日が来るのが怖い,16,2
22,朝が来て悪くなってるかもしれないと,朝が来て悪くなってるかもしれないと,17,0
23,でもお父さんが聞いたら大変だね,でもお父さんが聞いたら大変だね,15,0
24,だってわたし病気になっちゃったでしょ,だって私病気になっちゃったでしょ,18,3
25,だから先輩にも迷惑かけちゃうかも,だから先輩にも明惑かけちゃうかも,16,1
26,不公平なことをしようとしてるのは,不公へいなことを使用としてるのは,16,5
27,花火大会ぐらい一緒に行くでしょ,花び大会グライイッショに行くでしょ,15,8
28,できること自分から投げ出すなんて,できること自分から投げ出すなんて,16,0
29,神様は不公平だなんて言った,神様は不降閉だなんて言った,13,2
30,浴衣着て髪アップにしたら,床たきてカミアップにしたら,12,5
31,先輩きっとびっくりするわよ,先輩きっとびっくりするわよ,13,0
32,お母さんの後光が見えてきたような気がする,お母さんのごこうが見えてきたような気がする,20,3
33,わたしは自分を信じて行動すればいい,私は自分を信じて行動すればいい,17,3
34,やっぱ夏は浴衣とスイカと,やっぱなつは床と推加と,12,7
35,お友達もみんなついてるし,お友だちもみんな付いてるし,12,3
36,見つける必要があります,見つける必要があります,11,0
37,夏休みを利用して検査のための,夏休みを利用して検査のための,14,0
38,入院をされてはいかがでしょうか,入院をされてはいかがでしょうか,15,0
39,効果には個人差があるので,交化には個人差があるので,12,2
40,少し長くなるかもしれないから,少し長くなるかもしれないから,14,0
41,お前たちもう遅いから寝なさい,お前立ちもう遅いからねなさい,14,2
42,周りが目に入らなかったんだよ,周りが目に入らなかったんだよ,14,0
43,リハビリを担当する田辺です,リハビリを担当するタナベです,13,3
44,ショックも考えてみろよ,ショックも考えてみろよ,11,0
45,患者も医師も治療に専念する,患者も医師も治療に戦年する,13,2
46,すぐお見舞い行かなきゃ,すぐおみまいいかなキャ,11,5
47,クラスのみんなに声かける,クラスのみんなに声かける,12,0
48,亜湖お母さん夕方病院寄ってくるから,あこお母さん有がた病院よってくるから,17,6
49,遅くなると思うんだけど,おそくなると思うんだけど,11,2
50,なるべく早く帰るようにはするけど,なるべく早く返るようにはするけど,16,1
51,わたしマミと約束あるんだから,私真人約速あるんだから,14,7
52,今は家族が一致団結して,今は家族が一致団決して,11,1
53,ガトーボヌールのケーキだ,がトUボヌUルのケUキだ,12,4
54,一応人数分買ってあるわよ,一応人数分かってあるわよ,12,1
55,麻生君に会いたくて来たのにね,麻生くんに合いたくてきたのにね,14,4
56,一応声はかけたんっすけどね,一王声はかけ単作けどね,13,5
57,何か感じが変わっちゃった,何か感じが変わっちゃった,12,0
58,今度は捕まんないようにしろよ,今度はつかまんないように白よ,14,4
59,途中まで一緒にいたんだけど,と中まで一緒にいたんだけど,13,1
60,次の日川島で発見されたの,次の日代渡党で発見されたの,12,3
61,あんまり信用してないらしい,アンマリ信用してないらしい,13,4
62,友達来てくれてよかったわね,友だちきてくれてよかったわね,13,3
63,こんなにたくさんもらっちゃった,こんなにたくさんもラッチャッタ,15,6
64,動いてくると思いますけれども,動いてくると思いますけれども,14,0
65,両手を上げて手のひらを上にして,両手を上げててのひらを上にして,15,1
66,デートに行けるとなったら,デUトに行けるとなったら,12,1
67,そんなことないですって,そんなことないですって,11,0
68,今できること頑張るって決めたんだ,今できることがんばるって決めたんだ,16,3
69,原因不明の神経変性疾患,原因不明の新経変成率感,11,4
70,じゃあ結局今日の池内との,じゃあ結局強の移け打ちとの,12,6
71,どうしようかと思ってさ,同使用化と思ってさ,11,6
72,せっかくの誕生日の日に,せっかくの誕生日の日に,11,0
73,さっき病院に電話きてた,昨季病院に電話来てた,11,4
74,メスは餌を探しに出るんだけど,メスはエサを探しに出るんだけど,14,2
75,その間どんなに腹減っても,その間どんなにはら減っても,12,2
76,ずっと卵守って待ってんだよ,ずっと卵まもって待ってんだよ,13,2
77,本当は先輩は来ないかもって思ってた,本当は先輩はこないかもって思ってた,17,1
78,何言ってるか分かんなくなっちゃうんだって,なに行ってるかわかんなくなっちゃうんだって,20,4
79,最後には寝たきりになって,最後には寝たきりになって,12,0
80,その人物は派手なパンクファッションに,その人物ははでなパンクファッションに,18,2
81,身を包んでいたそうですが,身をつつんでいたそうですが,12,2
82,まさにあんな感じでした,まさにあんな感じでした,11,0
83,記憶には自信があるんです,記憶には自信があるんです,12,0
84,先ほどあなたが見たのは,先ほどあなたが見たのは,11,0
85,さっき記憶には自信があると,さっきき奥には自信があると,13,2
86,自信がなくなってきました,自信が亡くなってきました,12,1
87,でも見てみたかったわね,でも見てみたかったわね,11,0
88,いろいろ教えてくださいね,いろいろ教えてくださいね,12,0
89,事務所の経営に貢献してくださいね,事務所の経営に貢献してくださいね,16,0
90,それはいいじゃないですか,それはいいじゃないですか,12,0
91,協力したのは私たちです,協力したのは私たちです,11,0
92,私も協力をお願いされたら,私も協力をお願いされたら,12,0
93,カツラぐらいは被りましたよ,かつらぐらいは公務ましたよ,13,5
94,私もちょっとは協力しました,私もちょっとは協力しました,13,0
95,こういう時はじゃんけんでしょ,こういうときはジャンケンで初,14,9
96,宮田さんじゃんけんに勝てて,宮田さんじゃん件に勝てて,13,2
97,思いっきりのんびりしちゃいましょ,思いっきりのんびりしちゃいましょ,16,0
98,とりあえずお風呂入りましょうね,とりあえずオフロは入りましょうね,15,4
99,恐ろしい殺人事件が起きる事など,おそろしい殺人事件が起きることなど,15,4
100,のんびりしようって言いましたよね,のんびりしようっていいましたよね,16,1
101,プロデューサーの仕事でしょ,プロデュUサUの仕事でしょ,13,2
102,撮り方の工夫で何とかするから,取り方の工夫でなんとかするから,14,3
103,あさすが大女優って感じ,朝すが大女優って感じ,11,2
104,高校の時の友人なんです,高校の時の友人なんです,11,0
105,私たちここに泊まってるの,私たちここに泊ってるの,12,1
106,まだ駆け出しみたいですけど,まだかけ出しみたいですけど,13,1
107,お肌ツルツルになるんですって,おは脱るつるになるんですって,14,5
108,いろいろと苦労したんだね,いろいろと苦労したんだね,12,0
109,私は今回だけなんだけどね,私は今回だけなんだけどね,12,0
110,真理江さんは体調が悪いみたいで,マリエさんは体長が悪いみたいで,15,4
111,何かちょっと怖そうな人ね,何かちょっと怖そうな人ね,12,0
112,ホントはいい人なんだよ,ほんとはいい人なんだよ,11,3
113,朝から監督の姿が見当たらなくて,朝から監督の姿が見当たらなくて,15,0
114,スケジュールも狂っちゃって,スケジュUルもクルっちゃって,13,3
115,私そんなメール出してません,私そんなメUルだしてません,13,2
116,送信記録が残ってますよ,そう新記録が残ってますよ,11,3
117,温泉で殺人事件と遭遇したの,温泉で再人事件と総遇したの,13,2
118,写真だけでわかるわけないだろ,写真だけでわかるわけないだろ,14,0
119,山岡監督と田代睦美の間には,山岡監督と多白む積みの間には,13,5
120,という憶測が飛び交っている,という億束が飛びかっている,13,3
121,マスコミで話題になっている事件だけに,マスコミで話題になっている事件だけに,18,0
122,勝訴すれば事務所の名前が上がりますね,消訴すれば事務所の名前が上がりますね,18,1
123,あなたがそこまで言うんだったら,あなたがそこまでいうんだったら,15,1
124,それは私がよく知っています,それは私がよく知っています,13,0
125,ホテルの最上階にある展望風呂,ホテルの最上階にある展望フロ,14,2
126,郡山まで行く車の中から,氷山まで行く車の中から,11,1
127,先に帰ったお詫びをしておこうと思って,先に帰ったお詫びをしておこうと思って,18,0
128,そこで最上階の展望風呂の事を,そこで再乗会の展望フロのことを,14,7
129,お肌がツルツルになるから,お肌が鶴るるになるから,12,4
130,協力するから何でも言ってね,協力するから何でも言ってね,13,0
131,誰かが勝手に自分の携帯を使って,誰かが勝手に自分の携帯を使って,15,0
132,真犯人が見つからないまでも,新半人が見つからないまでも,13,2
133,では被告人は席に戻ってください,では被告人は責に戻ってください,15,1
134,切迫流産の危険があったそうですが,設迫龍山の危険があったそうですが,16,3
135,数日入院すれば心配ないそうです,数日乳院すれば心配ないそうです,15,1
136,じゃあ裁判はいずれ再開されますね,じゃ朝い版はいずれ再開されますね,16,3
137,それにしても前代未聞ね,それにしても前代未問ね,11,1
138,睦美どうして教えてくれなかったんだろう,むつみどうして教えてくれなかったんだろう,19,3
139,監督が恨まれるなんてないと思う,監督が裏まれるなんてないと思う,15,1
140,厳しいけど思いやりのある人だから,厳しいけど思いやりのある人だから,16,0
141,常連に売ったような気がしますね,常連に行ったような気がしますね,15,1
142,じゃ山岡さんが殺害された時刻に,ジャヤマオカさんが殺害された時刻に,15,6
143,ラウンジであなたと一緒にいたのは,ラウンジであなたと一緒にいたのは,16,0
144,ありがとうございました,ありがとうございました,11,0
145,何か睦美ちゃんに不利になる事を,何かむつみちゃんに振りになることを,15,7
146,告げ口するみたいで話しにくくてね,つげぐちするみたいで話にくくてね,16,4
147,拘置所に戻されたそうよ,高知初に戻されたそうよ,11,3
148,色々訊いて回ったんですけど,いろいろ聞いてまわったんですけど,13,7
149,あの日先に東京に帰ってます,あの日先に東京に帰ってます,13,0
150,香山プロデューサーが証言してます,傘マプロデュUサUが正現してます,16,6
151,インターネットを通じて投稿するんです,インタUネットを通じて投稿するんです,18,1
152,この動画が投稿されたのが,この動画が投稿されたのが,12,0
153,つまり事件翌日の朝です,つまり事件翌日の朝です,11,0
154,やっぱり撮影されたのは,やっぱり撮影されたのは,11,0
155,帽子とマスクの男いたじゃないですか,防子とマスクの男いたじゃないですか,17,1
156,あの正体がわかったんです,あの正体がわかったんです,12,0
157,相手役を務める須藤健一さんから,相手約を務めるすとう直一さんから,15,5
158,抱負を伺いたいと思います,豊富をうかがいたいと思います,12,5
159,ファンの人は立ち入り禁止ですよ,ファンの人は立ち入り金誌ですよ,15,2
160,柔軟性があるって事じゃないですか,柔軟性があるってことじゃないですか,16,2
161,車まで乗せていただいて,車までのせていただいて,11,1
162,それはアリバイでも何でもないぞ,それはあり倍でも何でもないぞ,15,4
163,せっかく優しくしてあげたのに,せっかくやさしくしてあげたのに,14,2
164,先生この部屋何か暑くないですか,先生この部屋何か熱くないですか,15,1
165,リモコンどこいっちゃったんだろう,リモコンドコイっちゃったんだろう,16,3
166,ずっと聞かせてもらったってわけだ,ずっと聞かせてもらったってわけだ,16,0
167,お手柄と言いたいところだがな,お手がらといいたいところだがな,14,3
168,これが山村ヨウコの細胞,これが山村容子の裁望,11,5
169,あれならとっくに解析処理を終えた,あれならトックに解析処理を終えた,16,3
170,俺のほうでも調べてみたいんだ,オレの方でも調べてみたいんだ,14,4
171,訓練を受けた張本人ですら,訓練を受けたちょう本人ですら,12,3
172,耐え切れる者はいません,声切れるものはいません,11,4
173,一緒にご飯食べるところなの,一緒にごはん食べるところなの,13,2
174,こんな訪ね方しか出来なくて,こんな尋ね方しかできなくて,13,3
175,あるヤツの名前と住所を,あるやつの名前と住所を,11,2
176,そしたら本当にそいつが死んで,そしたら本当においつが心で,14,3
177,やつらにやられっぱなしだ,やつらにやられっぱなしだ,12,0
178,いま少し休ませてるんです,います子し休ませてるんです,12,2
179,再開されることへの恐怖を抱きます,再開されることへの脅負を抱きます,16,2
180,間もなく彼女は落ちます,まもなく彼女は落ちます,11,1
181,しっかり覚えてほしんだけど,しっかり覚えてほしんだけど,13,0
182,父親のことをあいつに知らせるな,父親のことをあいつに知らせるな,15,0
183,全然落ちねーじゃないか,全然落んネUジャないか,11,5
184,予想以上に粘っています,予想以上に粘っています,11,0
185,だったらもっとレベルを上げろ,だったらもっとレベルを上げろ,14,0
186,死んでしまったら二度と手がかり,新でしまったらにどと手がかり,15,4
187,関わらせることは本当に避けたいんだが,かかわらせることは本当に避けたいんだが,18,2
188,あいつらを捕まえるチャンスなんだろ,あいつらを使まえるチャンスなんだろ,17,1
189,テロリスト確保の際に何かあった時は,テロリスト角保の際に何かあったときは,17,3
190,国を守ることが最優先だ,国を守ることが採由先だ,11,2
191,でもちょっと元気出てきました,でもちょっと元気出てきました,14,0
192,その人に会わせてあげる,その人に合わせてあげる,11,1
193,そんなもんさっきの青い車を,そんな文作期の青いくるまを,13,8
194,捕まえてみればわかるんだよ,つか前手見ればわかるんだよ,13,5
195,もう少しで大切な証人を,もう少しで大切な賞任を,11,2
196,少々強引なところがありまして,少々合員なところがありまして,14,2
197,何かいじってないと落ち着かなくて,何会実手ないと落ちつかなくて,16,6
198,自動車販売会社に勤める,自動車販売会社につとめる,11,2
199,現場に争った形跡がなかったことから,現場にあらそった形跡がなかったことから,17,3
200,ずいぶん辺鄙なところだな,ずいぶん返秘なところだな,12,2
201,ウイルスを隠しているんだから,ウイルスを各しているんだから,14,1
202,仲間を引き連れて戻ってくるかもよ,仲間を引き連れて戻ってくるかもよ,16,0
203,下手な心理戦仕掛けやがって,ヘタな新理線しかけやがって,13,6
204,俺たちに何も出来なくさせる,オレたちに何もできなくさせる,13,4
205,今のところ見当たらない,今のところ見当たらない,11,0
206,そんなもんさっきの青い車,そんな文作機のおおいくるま,12,10
207,俺も早く気づくべきだった,オレも早く気付けきだった,12,5
208,あんたが犯人だってわかるようになっています,アンタが犯人だってわかるようになっています,21,3
209,言い訳は本部でゆっくりしろ,いいわけは本部でゆっくり白,13,5
210,あなたは私たちが言うことを,あなたは私たちがいうことを,13,1
211,ヒーローが犯人の背中に,ヒUロUが反人の背中に,11,3
212,これからは嘘だって思いなさい,これからは嘘だって思いなさい,14,0
213,それじゃあ最後にもうひとつ頼む,それじゃ朝日後にもう一つの無,15,6
214,上空から現場の画定はできません,乗空から現場の確定はできません,15,2
215,その後の状況報告お願いします,その後の状況報告お願いします,14,0
216,お互い頑張って生きていきましょうね,お互い願ばっていきていきましょうね,17,3
217,報告が送れてすみません,報告が遅れてすみません,11,1
218,銃を奪われ撃たれました,重を奪われて足まました,11,4
219,自分の正体がバレたのか,自分の商待がバレたのか,11,2
220,このままの流れで決行だ,このままの流れで結構だ,11,2
221,高木君家にいなかったんだけど,高木君家にいなかったんだけど,14,0
222,こちらの方とも確認してみます,こちらの方とも確認してみます,14,0
223,遥ちゃん今病院なんですけど,春かちゃんこん病院なんですけど,13,4
224,お兄さんのことすごく心配していて,おにいさんのことすごく心配していて,16,2
225,あちこちに大きいホースが,あちこちに大きいホUスが,12,1
226,今すぐ空調を全部止めて,今すぐ空長を全部止めて,11,1
227,感染したと決まったわけじゃないだろう,感染したと決まったわけじゃないだろう,18,0
228,対テロを専門としている組織だ,タイテロを専門としている組織だ,14,2
229,研究室に戻る気はありません,研究室に戻る気はありません,13,0
230,やっぱり食われたのは宝生,やっぱりくわれたのは放証,12,3
231,我々へのウィルステロは失敗だ,われわれへのウィルステロは失敗だ,14,4
232,全員殺すつもりだったの,全員コロスつもりだったの,11,3
233,すぐに出動の要請をする,すぐに出動の要請をする,11,0
234,当たれば高圧電流が流れて,あたれば高圧電流が流れて,12,1
235,どうしたらこの国を救えるのか,どうしたらこの国を救えるのか,14,0
236,俺にはただずっと側にいてほしい,オレにはただずっと側にいてほしい,15,2
237,これを届けにきてくれたの,これを届けに来てくれたの,12,1
238,あなたに会いたいって言ってるのよ,あなたに合いたいって言ってるのよ,16,1
239,でもこれで追跡は不可能よ,でもこれで追加機は不可能よ,12,2
240,相変わらず気持ちいいほど自分本位,相変わらず気持ちいいほど自分本位,16,0
241,科学捜査などの専門的捜査で,加学捜査などの専門的操作で,13,3
242,凶悪犯罪に対応していくチムです,教圧犯罪に対応していくちむです,15,4
243,あの女と同期だそうです,あの女と同期だそうです,11,0
244,それに新しい部署の失敗は,それに新しい部所の失敗は,12,1
245,どこの部署からもいらない精鋭たちが,どこの部所からもいらない性映達が,17,5
246,容疑者じゃありませんよ,容疑者じゃありませんよ,11,0
247,暴力事件を起こしてましてね,暴力時件を起こしてましてね,13,1
248,どうぞよろしくお願いします,どうぞよろしくお願いします,13,0
249,こんな部署やることないでしょ,こんな部所やることないでしょ,14,1
250,身元不明の焼死体が発見された,身元不明の承し体が発見された,14,2
251,上半身が丸焦げだったようです,上阪神が丸子下だったようです,14,4
252,あと片腕が折れていたとか,あとかた腕がおれていたとか,12,3
253,わたし刑事じゃないですから,私形辞じゃないですから,13,5
254,警察といえどもね異動はあるの,警察といえども現動はあるの,14,2
255,わたし人間に興味ないんで,私人現に興味ないんで,12,4
256,片桐さんにはお似合いですね,型切りさんにはおにアイデスね,13,8
257,相当手広くやっていたようで,相当テビロクやっていたようで,13,4
258,炭化した内臓が粉砕してた,単化した内蔵が踏ん最してた,12,5
259,着任早で張り切ってんのは分かるが,着任はやではりきってんのはわかるが,16,5
260,鉄塔に登らせた可能性が,鉄頭に上らせた可能性が,11,2
261,じゃあこの着信履歴調べれば,じゃあこの着信理歴調べれば,13,1
262,それからついでに現場で,それからついでに現場で,11,0
263,それにそんな薬品なんて,それにそんな役品なんて,11,1
264,近どこかと合併するとか,金度こかと合併するとか,11,2
265,業界大手のグロリアス薬品と,業界大手のグロリアス約ヒント,13,4
266,またテレビで報道されると思います,またテレビで報道されると思います,16,0
267,焼死ならそうはいかないわ,少しならそうはいかないわ,12,2
268,わたしがこの目で確認してる,私がこの目で確認してる,13,3
269,指示を受けていたことが分かってる,支持を受けていたことがわかってる,16,3
270,摩擦で爆発するようになっていた,まさつで爆発するようになっていた,15,3
271,つまり一度着たら脱ぐことのできない,つまり一度きたらぬぐことのできない,17,2
272,一番いやなことさせたわけか,一番癒なことさせたわけか,13,2
273,あまり評判のよくない銀行です,あまり評判のよくない銀行です,14,0
274,次の犯行もすぐに起こるわ,次の半行もすぐに起こるわ,12,1
275,改造したスタンガンが見つかった,改造したスタンガンが見つかった,15,0
276,セットされてる可能性が極めて高い,セットされてる可能性が極めて高い,16,0
277,そういうことだ遊んでる暇はない,そういうことダアソンデルひまはない,15,8
278,やはり爆弾はセットされてるな,やはり爆弾はセットされてるな,14,0
279,時間なんて気にする必要ない,時間なんて気にする必要ない,13,0
280,かなり精密にやらないと,かなり成密にやらないと,11,1
